tweet,tweet_url
"@BANGSAygSUJUD Coba sesekali share keberhasilan Prabowo,biar orang orang yg belum nentuin pilihan politik bisa tau apa prestasinya.",https://twitter.com/danielbutar21/status/1693516080864805018
"✍️ Jokowi, Mega Ricuh, Rakyat &amp Anies Happy…” by Faizal Assegaf (kritikus) Di pusaran Istana, Prabowo dan Ganjar jadi wayang berebut kuasa. Teater norak, menyeret Jokowi dan Megawati beradu jotos politik. Rakyat cerdas mengamati, sambil ngipas. Entah tipu-tipu atau serius,… https://t.co/PjEq2Vjxue",https://twitter.com/faizalassegaf/status/1693516000321507611
"ini kenapa trending pak prabowo dah, dah kek ahli politik aja guwe 🤣 https://t.co/y2GdBImFCI",https://twitter.com/ca_soobin/status/1693515735916757119
"Selain HAM, Politik Identitas dan Ketidakjelasan Program jadi Catatan Hitam Prabowo https://t.co/3YCAwYSOpM",https://twitter.com/inilahdotcom/status/1693513789461979198
pasangan calon presiden dan wakil presiden diusulkan oleh partai politik atau gabungan partai politik peserta pemilu yang memenuhi persyaratan perolehan kursi paling sedikit 20 persen #Jokowinomics Prabowo Subianto,https://twitter.com/zxnm88473822/status/1693512271627223082
"Survei Capres Indikator: @ganjarpranowo Rebound, Prabowo Mulai Gembos Lembaga Survei Indikator Politik Indonesia merilis hasil jajak pendapat terbaru yang menunjukkan elektabilitas bakal calon presiden (bacapres) Ganjar Pranowo rebound atau kembali naik. #GanjarRebound https://t.co/YVUoO343GW",https://twitter.com/Aryprasetyo85/status/1693511885243736523
Politikus PDIP Budiman Sudjatmiko berbalik arah mendukung Prabowo Subianto maju sebagai capres 2024. Bagaimana nasib Budiman? Join #MedcomHariIni bersama Pengamat Politik/ Direktur Eksekutif Lingkar Madani Ray Rangkuti di X Spaces @medcom_id sore ini ya! https://t.co/8wvWRomWOt,https://twitter.com/medcom_id/status/1693511624458690836
Survei Indikator Politik: Elektabilitas @ganjarpranowo Rebound Ungguli Prabowo #GanjarRebound https://t.co/KmsTKKR5Ad,https://twitter.com/Aryprasetyo85/status/1693511532561514951
"Demi ambisi politik, Prabowo bawa gerbong ormas radikal di Pilpres 2024, #PrabowoSubianto https://t.co/j4VbMNRpQJ",https://twitter.com/WillowTravis3/status/1693511333822730622
Politik Prabowo adalah politik merangkul bukan memukul https://t.co/gGS6XfWtcG,https://twitter.com/Haris_indira/status/1697034091785543881
"Setujukah Anda para Bacapres, Anies, Ganjar, dan Prabowo menyampaikan gagasan dan berdebat di kampus sekaligus menjadi bagian dari pendidikan politik untuk generasi muda? Ikuti pembahasannya di #BedahEditorial di kanal youtube metrotvnews"" https://t.co/4iZgIzHNjN #Capres… https://t.co/QWa8Sap93V""",https://twitter.com/Metro_TV/status/1697033147152728335
"@cakimiNOW Nampaknya @cakimiNOW tdk sadar terseret masuk permainan Prabowo. Sama-sama pemain, kita lihat langkah selanjutnya Cak Imin, apa yg dilakukan utk bisa survive dlm kemelut politik ini.",https://twitter.com/AndiDarwis71/status/1697022423508636150
"@Miduk17 Pak Prabowo tau ini bukan panggung politik, suasana Religius bukan suasana pamer sok hebat. justru di sinilah terlihat Kehebatan Pak Prabowo kelihatan capres yang ikhlas. Semoga 2024 Presidennya Pak Prabowo.",https://twitter.com/rifan745/status/1697021487641972791
@Heraloebss @arvindonoviar @__AnakKolong @budimandjatmiko @prabowo Akun politik tp baperan. Aneh bgt. Entah baru kenal politik atau mmg gak paham konsekuensi politik. Atau dia kira politik itu hrs pasti begini/begitu.,https://twitter.com/SastroMeneh/status/1696997483157835804
"@dekade_08 Iyaakkk bener! Politik Prabowo adalah politik beretika dan memprsatukan,misal memasang baliho Prabowo Capres -Gibran cawapres, merubah nama koalisinya menjadi koalisi Indonesia maju!",https://twitter.com/HarnadiHidayat/status/1696991417946788027
"Tentu saja ada konsultan politik yang senantiasa mengarahkan gerak gerik Prabowo di publik, tetapi saya anggap bukanlah mereka yang bisa mengubahnya.",https://twitter.com/kailaniima/status/1696963481239695787
"Gue yakin, sikap arogansi Prabowo tidak akan pernah akan dijumpai lagi sekarang, bukan karena dia sudah berubah, melainkan bagian dari siasat branding politik untuk memikat pemilih",https://twitter.com/kailaniima/status/1696963420342596091
"Sebuah survei lawas, menjelang Pilpres 2014 yang diselenggarakan oleh Laboratorium Psikologi Politik Universitas Indonesia, menyimpulkan Prabowo memiliki kecenderungan gaya kepemimpinan otoriter.",https://twitter.com/kailaniima/status/1696963378516996578
Narasi sejarah kedua yang bisa menggambarkan seperti apa sifat temperamen Prabowo adalah saat dia marah besar kepada almarhum Presiden BJ Habibie ketika terjadi krisis politik dan ekonomi pada 1998.,https://twitter.com/Ali_doniii/status/1696960237100741058
"@danielht2009 @lhayesno @prabowo Jika pertanyaan anda spt itu, artinya anda tdk mengikuti sejarah politik bangsa ini. Sjk dulu aktivis prodem sll menolak @prabowo . Baik sbg cawapres mega ataupun capres. Makanya dia sll kalah dlm pertarungan. Era awal 2000an medsos tdk semasif skrg. Protespun tdk akan nampak"".""",https://twitter.com/Harya_117/status/1696959928404214172
@OposisiCerdas Prabowo mnyesal dekat dgn kalangan ulama Ganjar dekati kalangan ulama Yg teriak teriak politik identitas mana ini orang nya ?,https://twitter.com/JendralKepitin9/status/1696958607785603114
"Hasil Survei Litbang Kompas, Indikator Politik, SMRC dan LSI: Elektabilitas Prabowo Melemah https://t.co/sU7a1oCvMY",https://twitter.com/suaramerdekajkt/status/1696955215466111355
"Pandangan ini didasarkan pada analisis dan penilaian para psikolog terhadap perilaku dan pola pikir Prabowo, serta pengalaman dan rekam jejaknya dalam dunia politik dan militer.",https://twitter.com/Suseno__joko/status/1696951532238024756
"Sebuah survei lawas, menjelang Pilpres 2014 yang diselenggarakan oleh Laboratorium Psikologi Politik Universitas Indonesia, menyimpulkan Prabowo memiliki kecenderungan gaya kepemimpinan otoriter.",https://twitter.com/Suseno__joko/status/1696951453884231896
"Ini membuat peristiwa tersebut memiliki implikasi sosial, politik, dan sejarah yang kuat, dan sayangnya buruk buat penilaian keberhasilan pak prabowo",https://twitter.com/Andihermawannnn/status/1696942582478287269
"Isu ini juga telah dimanfaatkan oleh lawan-lawannya dalam perdebatan politik, dengan ini banyak sudah yang semakin percaya kalau pak prabowo memiliki kredibilitas rendah",https://twitter.com/Andihermawannnn/status/1696942568171516272
Dampak Politik: Kontroversi ini telah mempengaruhi pandangan masyarakat terhadap Prabowo dan kredibilitasnya sebagai seorang pemimpin dan kandidat politik.,https://twitter.com/Andihermawannnn/status/1696942562601537775
Poros Politik Capres Ganjar dan Prabowo Ketat – https://t.co/5YHf1VEsM6 https://t.co/dkPBo9aUFt,https://twitter.com/pemilunetwork/status/1696935161487589726
@RadioElshinta Ngak soal dgn PAN dan Golkar cukup bagi Prabowo maju Tampa PKB jadi ngak ngaruh koalisi tiga partai politik Golkar pan Gerindra cukup untuk pencalonan Prabowo,https://twitter.com/Didi_margo/status/1696934545030001054
Pengangkatan BJ Habibie sebagai presiden dan pemberhentian Prabowo adalah bagian dari dinamika politik yang terjadi pada saat itu.,https://twitter.com/Viennovalie/status/1696932925290459614
"#DiskusiInteraktif Menghitung dampak perubahan nama Koalisi Kebangkitan Indonesia Raya menjadi Koalisi Indonesia Maju bagi pencapresan Prabowo Subianto. Talk : Pengamat Politik, Jusuf Sursoso Streaming👇👇👇 https://t.co/TiuTKwH9L1 https://t.co/S68RzyNVcS",https://twitter.com/RadioElshinta/status/1696932039608643982
"Sekretaris Jenderal PAN, Eddy Soeparno, menyampaikan bahwa partainya menjalin kerja sama politik yang erat dengan PKB untuk mendukung calon Presiden (capres) Prabowo Subianto dalam Pemilu 2024, dengan penuh percaya. https://t.co/jAT4Pe2qdj",https://twitter.com/inversimedia/status/1696929536796144007
Elektabilitas Prabowo Melemah dalam 4 Survei Terbaru https://t.co/DZkwLeNmgv #politik #survey #prabowo #elektabilitas #terbaru #politikindonesia #pemilu2024,https://twitter.com/officialntv_/status/1696920605046788355
Presiden Jokowi Adalah Guru Politik Prabowo. #Prabowo #PrabowoSubianto #PrabowoPresiden #Pilpres2024 https://t.co/9dwDWj9aaY,https://twitter.com/Netizenn08/status/1696920352314834995
Artikel ini membahas tentang hasil prediksi bahwa hampir 40% pendukung Prabowo Subianto kemungkinan besar akan beralih mendukung Anies Baswedan dalam pemilihan tahun 2024. Prediksi ini didasarkan pada hasil survei yang mengindikasikan adanya pergeseran dukungan politik dari…,https://twitter.com/Avolanza/status/1696915676152393958
"@MuslihGus @BangPakatDayak @ganjarpranowo @prabowo @aniesbaswedan Kalo bagi saya (Muslim), ajaran kami mengajarkan tidak hanya urusan ibadah dengan Tuhan (Alloh) semata, tapi semua aspek kehidupan diajarkan (2:208, 5:03) termasuk didalamnya soal POLITIK (4:59 dll).",https://twitter.com/HasnaBerkah/status/1696913342865227854
"@Tan_Mar3M Gak mungkin dukung Amies tong apalagi Prabowo 🤣🤣🤣tegak lurus kader partai,kalau Sbg capres mah bodoh amat maw dukung itu hak politik siapapun ..",https://twitter.com/YoSetiabudi/status/1696912499298431289
Partai Politik Pendukung Prabowo Subianto dalam Pilpres 2024 https://t.co/1NGJiryuiy,https://twitter.com/BabeSulut/status/1696912053703995580
"Gampangnya krn di Anies Baswedan ada PKS. Masih ingat pemilu Jabar Pak @prabowo ? Seminggu sebelum pemilihan tiba-tiba ada tokoh politik yang menyerukan pindah dukungan dari cagub yang didukung sampean, krn wagubnya dari PKS :) https://t.co/z0A5LDQPZ7",https://twitter.com/BosPurwa/status/1696911216772603991
"@GunRomli Prabowo kan gak jago politik, tapi dipaksakan oleh konsultan politiknya",https://twitter.com/anharista/status/1696910708502585567
"Tanpa dicampuri urusan politik, Melihat Pak Prabowo trenyuh kasihan.. Nah sekarang mau jd Capres kebayang pasti akan melelahkan.otak dan energi. Partai atau kelompok atau pribadi yg mendukungnya kok tega y.. Saranku lebih baik jd penasehat saja, ini masukan dariku. https://t.co/SGUGRFNJx5",https://twitter.com/devy_casanofa/status/1696909246087266631
"Sosok Prabowo mengalami transformasi panjang dan berliku dalam perjalanan menjadi seorang pemimpin. Selesai membangun bisnis, ia memutuskan kembali dan membentuk partai politik Gerindra. #prabowo",https://twitter.com/sangtauladan/status/1696905074658992591
"Diacara mulataqo sufi sedunia ini kehadiran Pak @jokowi sebagai presiden,kehadiran pak @prabowo sebagai ketua panitia,kehadiran pak @ganjarpranowo sebagai gubernur jawa tengah. Kamu masih seret-seret kewilayah politik Asem tenan sampeyan mas Wongmu kabangten tenan pak ganjar",https://twitter.com/Hun_Slamet/status/1696904821058707581
"@HabiebBass Natalis ingat politik gondruwo, politik kuno . yg di tujukan prabowo. suara PSI nggak ngefek kepada pak ganjar.",https://twitter.com/UgengKece/status/1696901803835613645
Nantikan minggu ini surprisenya!! #golkar #golkarindonesia #airlanggahartarto #prabowo #gerindra #politik #parpol @golkar_id @airlangga_hrt https://t.co/cBi7iKFGYi,https://twitter.com/bapakbangsa__/status/1696901761842196504
Kalau kita kembali ke pilkada gub DKI 2017 pasti ingat apa yang @aniesbaswedan lakukan. Lalu pada pilpres 2019 pasti ingat ingat juga yang dilakukan @prabowo . Sama² memanipulasi agama dalam politik.,https://twitter.com/mahmara/status/1696899701872701590
"@GunRomli @ganjarpranowo Apakah Ganjar populis belaka seperti yang dituduhkan Budiman Sujatmiko, atau Ganjar juga memiliki pandangan strategi tentang geo politik global yang diklaim Budiman hanya dimiliki Prabowo?",https://twitter.com/JuliusMG1/status/1696898638440456556
"Prabowo, Terlalu Sering Memanfaatkan Sentimen Nasionalis. Terlalu sering, Prabowo terlihat memanfaatkan sentimen nasionalis untuk kepentingan politik pribadinya.",https://twitter.com/LilianaCindy_/status/1696894747426586754
"Prabowo mungkin berpikir bahwa menjiplak gaya Jokowi akan membuatnya lebih populer, tetapi sebenarnya itu hanya menciptakan citra bahwa ia tidak punya identitas politik yang jelas.",https://twitter.com/sofyan_har/status/1696894049746043002
Prabowo tampak seperti seseorang yang terjebak dalam permainan politik tanpa arah yang jelas. Menjiplak gaya Jokowi hanya menciptakan citra bahwa ia tidak punya visi dan prinsip yang kuat.,https://twitter.com/sofyan_har/status/1696893783462310018
Prabowo seakan terjebak dalam permainan pencitraan politik yang dangkal. Ia tak memiliki landasan kuat dalam memimpin dan mengambil keputusan yang bijaksana.,https://twitter.com/sofyan_har/status/1696893233052238173
"Bahwa Prabowo lbh kalem melihat fenomena Anies, itu bukti dia tlh banyak belajar utk ikhlas menerima kenyataan. Dunia politik mmg bgtu. Lidah tak bertulang. Uda ga kagetan lg. Shock breaker thd rasa geramnya jd lbh canggih berfungsi optimal",https://twitter.com/IrfanSofani/status/1696893214794322290
Survei LSI merekam selisih elektabilitas Ganjar dan Prabowo sangat tipis. Kompetisi yang semakin ketat dikhawatirkan memicu penggunaan kampanye hitam dan politik uang. #Polhuk #AdadiKompas https://t.co/6W39Qv6er0,https://twitter.com/KompasData/status/1696892905204367569
Survei LSI merekam selisih elektabilitas Ganjar dan Prabowo sangat tipis. Kompetisi yang semakin ketat dikhawatirkan memicu penggunaan kampanye hitam dan politik uang. #Polhuk #AdadiKompas https://t.co/YRr4Ag8zbz,https://twitter.com/hariankompas/status/1696891438326280335
"Kedekatan yang terjalin antara Prabowo dan Menteri Pertahanan AS, Lloyd James Austin III, mengundang kekhawatiran bahwa Indonesia mungkin akan terlibat dalam agenda politik Amerika Serikat yang tidak selalu sejalan dengan prinsip non-blok yang telah dijunjung tinggi. https://t.co/E8SZbsfIek",https://twitter.com/nttdotinfo/status/1696889463849271741
"Para ketua umum partai politik dalam Koalisi Indonesia Maju, segera bermusyawarah menentukan bakal calon wakil presiden pendamping Prabowo Subianto. #VideoBerita #AdadiKompas https://t.co/QuIemw3q8T",https://twitter.com/hariankompas/status/1696889257611162039
"Prabowo seakan lupa bahwa semua yang telah dia capai dalam politik adalah hasil dari dukungan dan kerja keras banyak orang. Namun, dengan pengkhianatan dan penyangkalan ini, ia seolah-olah ingin menghapus semua jejak pengorbanan mereka.",https://twitter.com/LilianaCindy_/status/1696887750518006019
"Nantikan Diskusi Interaktif malam ini: Menghitung dampak perubahan nama Koalisi Kebangkitan Indonesia Raya menjadi Koalisi Indonesia Maju bagi pencapresan Prabowo Subianto."" Narasumber: Jam 23:00 ::: Direktur Eksekutif PoliGov, Tri Andika. Jam 24:00 ::: Pengamat Politik,… https://t.co/sAx3sieeGt""",https://twitter.com/RadioElshinta/status/1696887396921450666
Ada sesuatu yang sangat tidak wajar dengan klaim Prabowo tentang kedekatan dengan Jokowi. Ia seakan tak memiliki akal sehat yang jelas dalam melihat realitas politik.,https://twitter.com/LilianaCindy_/status/1696886630500405631
Prabowo seakan mengabaikan fakta bahwa branding politik yang kuat adalah modal penting dalam memimpin. Tindakan menjiplak gaya Jokowi jelas menunjukkan ketidakmatangan dalam hal ini.,https://twitter.com/LilianaCindy_/status/1696885946925375689
"Prabowo seakan tak punya pegangan dalam realitas politik, sehingga ia masuk ke dalam alam delusi di mana ia bisa mengklaim kedekatan dengan Jokowi dan bahkan menjiplak gaya Jokowi. Ini adalah tanda nyata bahwa ia telah jauh terjatuh dalam keadaan yang tidak sehat secara mental.",https://twitter.com/Ganechaicha/status/1696883380401377431
Klaim Prabowo tentang kedekatan dengan Jokowi hanya menciptakan gambaran bahwa ia telah melampaui batas rasionalitas dalam politik. Tidak ada alasan untuk mempercayai tindakan dan klaimnya yang berbau delusi.,https://twitter.com/Ganechaicha/status/1696883319785365610
Prabowo tampaknya telah kehilangan jejak dalam realitas politik dan memilih untuk masuk ke dalam alam delusi yang ia ciptakan sendiri. Tindakannya yang mencoba menjiplak gaya Jokowi hanya mencerminkan seberapa jauh ia telah merambah ke dalam keadaan delusional.,https://twitter.com/Ganechaicha/status/1696883253821473246
Ada sesuatu yang sangat tidak wajar dengan klaim Prabowo tentang kedekatan dengan Jokowi. Ia seakan tak memiliki akal sehat yang jelas dalam melihat realitas politik.,https://twitter.com/Ganechaicha/status/1696883183109702014
Prabowo seakan telah memutuskan untuk mengabaikan realitas politik dan menggantinya dengan dunia delusi yang diciptakannya sendiri. Klaimnya tentang kedekatan dengan Jokowi adalah bukti nyata betapa jauhnya ia telah merajut jaringan pikiran yang tidak sehat.,https://twitter.com/Ganechaicha/status/1696883101740208510
Prabowo seolah tak memiliki batasan dalam delusi yang ia ciptakan. Klaimnya tentang kedekatan dengan Jokowi adalah contoh nyata betapa ia telah terjebak dalam dunia khayal yang tak sesuai dengan fakta politik.,https://twitter.com/Ruriindahchan/status/1696882857367536079
Klaim Prabowo tentang kedekatan dengan Jokowi hanya menciptakan gambaran bahwa ia sedang berada dalam alam delusi yang sangat dalam. Bagaimana bisa kita mempercayakan negara kepada seseorang yang tidak memiliki pandangan yang jelas tentang realitas politik?,https://twitter.com/Ruriindahchan/status/1696882786534146078
"Delusi Prabowo semakin terlihat jelas ketika ia mencoba untuk menjiplak gaya Jokowi, seolah-olah ia bisa menjadi Jokowi versi lain. Ini adalah contoh betapa jauhnya ia telah merambah dalam dunia khayal yang tak sesuai dengan realitas politik.",https://twitter.com/Ruriindahchan/status/1696882704753533123
"Prabowo seolah telah memasuki dunia khayalnya sendiri, di mana ia bisa dengan bebas mengklaim kedekatan dengan Jokowi dan bahkan meniru gaya serta tindakan Jokowi. Ini adalah tanda nyata dari delusi politik yang sangat mengkhawatirkan.",https://twitter.com/Ruriindahchan/status/1696882621035245632
"Sangat mengkhawatirkan melihat bagaimana Prabowo berperilaku secara delusional, seolah-olah ia adalah sosok yang sangat dekat dengan Jokowi. Ini hanyalah tindakan yang menciptakan gambaran seorang yang tidak waras dalam politik.",https://twitter.com/GGaluhP/status/1696881392968176055
"Prabowo Beri Nama Koalisi Menjadi Koalisi Indonesia Maju, Tiru Politik Jokowi? PDIP Beri Reaksi https://t.co/tvvVNt9a30",https://twitter.com/tvOneNews/status/1696881351050305654
Prabowo seolah tak sadar bahwa klaimnya tentang kedekatan dengan Jokowi hanyalah delusi belaka. Tindakannya ini hanya menciptakan gambaran bahwa ia tidak memiliki pegangan dalam realitas politik dan memasuki alam khayal yang berbahaya.,https://twitter.com/LilianaCindy_/status/1696879629900874077
Prabowo seolah telah terjebak dalam dunia khayalannya sendiri yang semakin delusional. Mengklaim bahwa ia dekat dengan Jokowi dan mencoba meniru gayanya hanyalah tanda bahwa ia sudah sangat kehilangan pijakan dalam realitas politik.,https://twitter.com/andiBnegara/status/1696879422454817270
Prabowo seakan tak memiliki pemahaman yang jelas tentang batas-batas realitas politik. Mengklaim kedekatan dengan Jokowi dan mencoba menjiplak gayanya hanya menciptakan kesan bahwa ia sudah sangat jauh terperangkap dalam dunia delusi politiknya.,https://twitter.com/Vivi4504289/status/1696879341253144788
Prabowo tampaknya tak lagi memiliki pijakan dalam realitas politik yang sebenarnya. Mengklaim kedekatan dengan Jokowi dan mencoba meniru gayanya hanya menciptakan citra bahwa ia tengah hidup dalam dunia khayalannya sendiri.,https://twitter.com/arifaannz/status/1696879325256044877
"Prabowo seakan tak memiliki panduan politik yang jelas, sehingga ia mudah terpengaruh oleh tren dan citra yang sedang populer. Ini adalah ciri-ciri seorang yang belum siap menjadi pemimpin negara.",https://twitter.com/Ganechaicha/status/1696879321741144529
Prabowo seolah berada dalam fase yang sangat delusional dalam kariernya. Mengklaim kedekatan dengan Jokowi dan mencoba meniru gayanya hanya menciptakan gambaran bahwa ia kehilangan akal sehatnya dalam politik.,https://twitter.com/andiBnegara/status/1696879245757173882
"Tindakan Prabowo yang semakin delusional, seperti mengklaim kedekatan dengan Jokowi dan mencoba menjiplak gaya beliau, hanya menciptakan citra bahwa ia sudah kehilangan koneksi dengan realitas politik.",https://twitter.com/FadilahsaidFF/status/1696879142447329322
Prabowo seakan mengabaikan fakta bahwa branding politik yang kuat adalah modal penting dalam memimpin. Tindakan menjiplak gaya Jokowi jelas menunjukkan ketidakmatangan dalam hal ini.,https://twitter.com/Ganechaicha/status/1696879136155766866
Kita melihat Prabowo semakin delusional dalam upayanya untuk menciptakan citra yang menguntungkan. Mengklaim bahwa ia mendapatkan restu Jokowi dalam setiap langkahnya dan menjiplak gaya beliau adalah bukti bahwa ia kehilangan akal sehatnya dalam politik.,https://twitter.com/Vivi4504289/status/1696879117260534249
Prabowo seolah hidup dalam dunia khayalannya sendiri. Menyebut dirinya sebagai sahabat Jokowi dan mencoba meniru gayanya menunjukkan bahwa ia tak lagi memiliki koneksi dengan realitas politik yang sebenarnya.,https://twitter.com/David_Anshari/status/1696879076919685265
Tidak bisa disangkal bahwa Prabowo telah memasuki wilayah yang sangat delusional. Mengklaim kedekatan dengan Jokowi dan mencoba menyerap popularitasnya dengan menjiplak gaya adalah tanda bahwa ia sudah semakin kehilangan pijakan dalam realitas politik.,https://twitter.com/ShilaaRR_/status/1696879063162376409
"Prabowo seakan tak punya pegangan dalam realitas politik, sehingga ia masuk ke dalam alam delusi di mana ia bisa mengklaim kedekatan dengan Jokowi dan bahkan menjiplak gaya Jokowi. Ini adalah tanda nyata bahwa ia telah jauh terjatuh dalam keadaan yang tidak sehat secara mental.",https://twitter.com/Vivi4504289/status/1696878926449021147
Klaim Prabowo tentang kedekatan dengan Jokowi hanya menciptakan gambaran bahwa ia telah melampaui batas rasionalitas dalam politik. Tidak ada alasan untuk mempercayai tindakan dan klaimnya yang berbau delusi.,https://twitter.com/arifaannz/status/1696878909818609973
Prabowo tampaknya telah kehilangan jejak dalam realitas politik dan memilih untuk masuk ke dalam alam delusi yang ia ciptakan sendiri. Tindakannya yang mencoba menjiplak gaya Jokowi hanya mencerminkan seberapa jauh ia telah merambah ke dalam keadaan delusional.,https://twitter.com/EllinRenata/status/1696878894886826301
Ada sesuatu yang sangat tidak wajar dengan klaim Prabowo tentang kedekatan dengan Jokowi. Ia seakan tak memiliki akal sehat yang jelas dalam melihat realitas politik.,https://twitter.com/David_Anshari/status/1696878882962489690
Prabowo seakan telah memutuskan untuk mengabaikan realitas politik dan menggantinya dengan dunia delusi yang diciptakannya sendiri. Klaimnya tentang kedekatan dengan Jokowi adalah bukti nyata betapa jauhnya ia telah merajut jaringan pikiran yang tidak sehat.,https://twitter.com/ShilaaRR_/status/1696878870840893498
"Jejak sejarah Prabowo banyak dipengaruhi oleh jejak sejarah keluarganya, terutama jejak ayah Prabowo, Soemitro Djojohadikusumo, sebagai tokoh politik yang memperjuangkan keyakinan politiknya dengan memilih keluar Indonesia. #prabowo",https://twitter.com/sangtauladan/status/1696878813802549472
Branding yang tak jelas dan tindakan menjiplak gaya Jokowi hanyalah menciptakan gambaran bahwa Prabowo tak punya pandangan politik yang kuat. Bagaimana kita bisa mempercayai pemimpin yang seperti itu?,https://twitter.com/Ruriindahchan/status/1696878724010869158
"Dlm sejarah politik pasca reformasi, mgkn org yg paling sering dikadalin ya Prabowo. Tak mudah baginya mjd politisi yg plintat plintut.",https://twitter.com/IrfanSofani/status/1696878700489580979
Prabowo seolah tak memiliki batasan dalam delusi yang ia ciptakan. Klaimnya tentang kedekatan dengan Jokowi adalah contoh nyata betapa ia telah terjebak dalam dunia khayal yang tak sesuai dengan fakta politik.,https://twitter.com/SherlyMoee/status/1696878639466324046
Klaim Prabowo tentang kedekatan dengan Jokowi hanya menciptakan gambaran bahwa ia sedang berada dalam alam delusi yang sangat dalam. Bagaimana bisa kita mempercayakan negara kepada seseorang yang tidak memiliki pandangan yang jelas tentang realitas politik?,https://twitter.com/Andripriadi_/status/1696878625683873976
"Delusi Prabowo semakin terlihat jelas ketika ia mencoba untuk menjiplak gaya Jokowi, seolah-olah ia bisa menjadi Jokowi versi lain. Ini adalah contoh betapa jauhnya ia telah merambah dalam dunia khayal yang tak sesuai dengan realitas politik.",https://twitter.com/FadilahsaidFF/status/1696878612157177969
"Prabowo seolah telah memasuki dunia khayalnya sendiri, di mana ia bisa dengan bebas mengklaim kedekatan dengan Jokowi dan bahkan meniru gaya serta tindakan Jokowi. Ini adalah tanda nyata dari delusi politik yang sangat mengkhawatirkan.",https://twitter.com/AmayAmaykholif/status/1696878594893451324
Bagaimana bisa kita mempercayakan negara kepada seseorang yang terlihat begitu terjebak dalam delusi? Klaim Prabowo tentang kedekatan dengan Jokowi hanya menciptakan gambaran bahwa ia tidak memiliki realitas politik yang sehat.,https://twitter.com/Vivi4504289/status/1696878579357778044
Prabowo seakan telah masuk ke dalam alam pikiran yang sangat terdistorsi. Klaimnya tentang kedekatan dengan Jokowi dan upaya untuk menjiplak gaya Jokowi hanyalah tindakan yang mencerminkan seberapa dalam ia telah terjerembab dalam delusi politik.,https://twitter.com/arifaannz/status/1696878566556700690
Prabowo seolah tak sadar bahwa klaimnya tentang kedekatan dengan Jokowi hanyalah delusi belaka. Tindakannya ini hanya menciptakan gambaran bahwa ia tidak memiliki pegangan dalam realitas politik dan memasuki alam khayal yang berbahaya.,https://twitter.com/David_Anshari/status/1696878538337439997
Prabowo tampak seperti orang yang kehilangan pegangan dengan realitas politik. Klaimnya tentang kedekatan dengan Jokowi adalah contoh nyata dari betapa ia telah terjerembab dalam alam delusi yang berbahaya.,https://twitter.com/Andripriadi_/status/1696878431978365389
