tweet,tweet_url
@bagaskara645y @logikapolitikid Anies sama Prabowo klo Anies kalah mereka ke Prabowo klo Prabowo kalah mereka ke Anies kelompok mereka kaya parasit,https://twitter.com/RivaldiFaza/status/1723128004816293951
@yuwantino12 @logikapolitikid @ganjarpranowo Klo Anies kalah mereka ke Prabowo klo Prabowo kalah mereka ke Anies yah ibaratnya kaya parasit hrus cri inang yg pas biar bsa di kontrol,https://twitter.com/RivaldiFaza/status/1723127623927427530
"@PS_presiden2024 Sebelum menjagokan pilihanya, coba cari sumber yg bagus. Ganjar, Anies, Prabowo dalam menyampaikan visi misinya seperti apa.dari sanalah kita bisa menetukan pilihan dengan bijak.jangan melihat mereka hanya dari 1 sisi aja. Ini bt kepentingan semua umat, bukan bt segelintir orang.",https://twitter.com/surpa_i/status/1723125911015584031
"Peta Elektabilitas Terkini: Prabowo-Gibran Unggul, Anies dan Ganjar Terlibat Persaingan Ketat https://t.co/CCTTcjeD80",https://twitter.com/zonajakarta1/status/1723124952898195528
@KrisyantoOni Anies dan Prabowo capres jalur independen ya?,https://twitter.com/enkaeriharmat/status/1723124795355824433
"Peta Elektabilitas Terkini: Prabowo-Gibran Unggul, Anies dan Ganjar Terlibat Persaingan Ketat https://t.co/lelzib8XgZ",https://twitter.com/RagamIndones1a/status/1723124559761867089
"Adu gagasan 3Capres mnurt penilaian ekonom UI Ibu Ninasapti Triaswati : Prabowo Ganjar yg ada hnya program tnpa hasil yg nyata sdangkan Pak Anies lbh realistis dg program yg jelas &amp pencapaian hasil akhirnya lbh nyata."" WHY NOT THE BEST!! https://t.co/icADASHyPc""",https://twitter.com/Malika6027/status/1723123874659962891
"@are_inismyname @jokowi @prabowo @99propaganda @Ndons_Back @bengkeldodo @P4P4B0W0_2024 @Zero8ok @AndreasSolusi @AlmaghribiS @adri_7i @DarekaRendy Mari kita dukung Prabowo, jangan lupa 14 Februari coblos Anies",https://twitter.com/PoernoAdiNug/status/1723122977884279135
@Tan_Mar3M Jni pertanyaan jebakan...klu berpengalam jadi capres yg prabowo 4 X dengan tahun ini..klu yg patut dan pantas jadi presiden ya Anies,https://twitter.com/BumiOfai/status/1723122796518334479
@DoankWarto Sakit hatinya ke prabowo tapi nyerangnya ke anies. Cucu kakek ini tololnya luar binasa https://t.co/PbFOGs5AgN,https://twitter.com/enddrue/status/1723122678339653804
Siapa Capres Cawapres paling peduli perempuan? Tirto telusuri visi misi ketiga paslon dg kata kunci “perempuan”. 1. Anies Muhaimin menyebut kata perempuan 19 kali. 2. Prabowo - Gibran menyebut sebanyak 11 kali 3. Ganjar - Mahfud 5 kali Cek detail programnya di bawah. Menarik!,https://twitter.com/tatakujiyati/status/1723122001253154889
"@VIVAcoid Prabowo doong. 55%. abis itu disantet deni çiregar. sakit. diganti Gibran. Gibran merasa kurang pengalaman, ditunjuklah anies setara perdana menteri karena memang cakap. begitulah kira-kira ramalan mbh hari ini. heuheu @jokowi @gibran_tweet ✌️",https://twitter.com/janetez69/status/1723121295041474612
Survei Poltracking: Elektabilitas Prabowo Terus Naik Ungguli Ganjar dan Anies https://t.co/wfeUz6ovIk,https://twitter.com/TajukPolitik/status/1723121117102243934
@kumparan ga usah di sebutin konstituen pan muhamadiyah.. muhamadiyah dukung anies itu pasti.. yg dukung prabowo elitenya doang..,https://twitter.com/AwalUdin149784/status/1723120640822255966
"@Dennysiregar7 Kayaknya, swing voter kemana arah telunjuk Jokowi memilih sebesar 16% menurut lembaga survey akan diuji benar or tidak. Artinya Kl benar artinya Prabowo bisa menang telak 1 putaran. Kl 2 putaran bisa2 tumpahan suara Anies masuk ke Prabowo.",https://twitter.com/Eltom29209317/status/1723120614263951457
Saya gak percaya. Saya membaca survei mereka selalu Ganjar + Prabowo &gt Anies. Gak percaya surva survei. Fokus kerja di lapangan,https://twitter.com/MichelAdam7__/status/1723120219584180264
"@msaid_didu Baca. Survey populi center paling aneh (Baca terkondisikan) , sangat JOMPLANG perbedaan elektabilitas antara Prabowo ke Ganjar maupun Prabowo ke Anies,, 20% . Masuk akal???????",https://twitter.com/DarneNyoman/status/1723116574662594628
@Asrodin77 @savicali Justru prabowo apa buktinya dia gak pelanggaran HAM? Emang udah diinvestigasi? Emang udah diadili? Dulu gw 2 kali dulu prabowo bos. Tpi gw fair pake akal sehat. Cawapres nya aja dari hasil pelanggaran begitu. Apa gak malu? Punya moral etic? Dri semua ya mending anies lah.,https://twitter.com/incursioevan/status/1723113127498432620
"Serangan2 terhadap keluarga Jokowi di media sosial ternyata tak cukup mendongkrak suara Ganjar. Justru yg tjd pendukung Jokowi yg semula mendukung Ganjar, ambrol besar-besaran ke Prabowo-Gibran &amp sebagian ke Anies. Sekali lagi, memukul yg berakibat terpukul.",https://twitter.com/TopanTj/status/1723108813086355848
"Pengakuan jujur Prabowo,Ganjar , Mahfud MD,Gibran dan jokowi Anies sosok cerdas"" Anies memang capres yg paling layak jadi presiden 2024, memimpin negri ini . https://t.co/pHRmzyXAxs""",https://twitter.com/124hmahHastut11/status/1723107244429193671
"Top News: Suspensi Emiten CUAN dan BREN, Suara Prabowo dan Anies Naik https://t.co/NaX6lGOxUi",https://twitter.com/KATADATAcoid/status/1723105774480802161
"@kompascom Perolehannya 55,8 persen Prabowo-Gibran. 28,8 persen Anies-Muhaimin. Undecided (yang belum memilih) nya 15,4 persen,"" ujar Hanta. Ini pernyataan aneh, Anies-Muhaimin dapart berapa presen pada putaran pertama sehingg lolos ke putaran dua?""",https://twitter.com/gunaditaufiq33/status/1723101971870261539
"@are_inismyname @jokowi @prabowo @99propaganda @Ndons_Back @bengkeldodo @P4P4B0W0_2024 @Zero8ok @AndreasSolusi @AlmaghribiS @adri_7i @DarekaRendy Kalau Prabowo - Ganjar ya yakin bisa kalahkan Anies - Cak Imin. ini malah ambil gibran.haduh..berat jendral..kecuali pak MK masih paman saya,tapi nasi sudah jadi tai ..susah kalau udah begini",https://twitter.com/ratno_willist/status/1723100132772889064
"@PDemokrat om, feeling gw nih, yg ke putaran ke-2 Prabowo - Anies. yg menang Anies. ini semua karena kesalahan kalian cawapresin Gibran. PD mulai komunikasi ma PKS-PKB aja biar masuk kabinet.",https://twitter.com/prayudha12/status/1723099733403783588
"@_rakyatmerdeka Bagi saya, Prabowo, Ganjar, ataupun Anies itu gak penting. Tapi, bagi Indonesia yg besar dg segala persoalan dlm negeri yg krusial dan tantangan dunia global, Indonesia membutuhkan seorang pemimpin yg tangguh dan berkelas internasional. Itulah Prabowo Subianto.",https://twitter.com/SolihatMuhammad/status/1723097385205989500
Sederet Hasil Survei Capres 2024: Anies Vs Prabowo Vs Ganjar - CNBC Indonesia https://t.co/BKT3pK62dV #Prabowo #PrabowoUnggul,https://twitter.com/fathw25/status/1723073434119524355
"@PartaiSocmed @hantayuda Aneh sih klo prabowo yg di atas secara pendukung prabowo dulu udh sebagian pindah ke anies , prabowo ambil kaesang dgn mksd ngambil simpatisan jokowi sdngkan simpatisan jokowi udh ke pecah ganjar swbagian .. Apa th ini si itu yg sengaja"" di menangkan 😂""",https://twitter.com/Nengeli16/status/1723065427805212727
@RengganisID @ernestprakasa Kalo gak pilih banteng terus pilih Anies berarti nalar anda sehat. Kalo no banteng tapi pilih Prabowo itu gak masuk secara nalar. 🤭😅,https://twitter.com/Interista082/status/1723060333672038567
"@Miduk17 Bang. Kalau hanya nyerang Gibran melalui medsos, ternyata gak ngefek blass. Survei terakhir malah semakin tinggi tu Prabowo sama Anies, Ganjar malah mlorot. Saran ni bang. Modal glontorkan, langsung turun ke bawah. Dijamin beres.",https://twitter.com/duwetz/status/1723049171807072359
"@alextham878 Justru serangan masiv ke Jokowi dan keluarga menaikkan elektabilitas Prabowo Gibran dan Anies Imin, terus Ganjar Mahfud semaput. Ini akibat ulah busuk dan licik menzolimi tanpa henti.",https://twitter.com/Marconi70456466/status/1723047737501889016
"@Dennysiregar7 2024 yg bertarung cuma prabowo dan anies, Ganjar cuma pemain tambahan 🤣🤣🤣",https://twitter.com/budiant85867360/status/1723045264712163562
"@DedynurPalakka @jokowi ada juga politisi yg tersandera : Prabowo, Airlangga, Zulhas, SBY, AHY ada yg terpaksa : SBY, AHY, Fahri Hamzah ada yg takut bapak : Kaesang ada yg takut mertua : Bobby Hanya Ganjar, Mahfud MD, Anies, dan Cak Imin yg berani melawan",https://twitter.com/nyinyirsedunia/status/1723043581953228965
@DedynurPalakka @prabowo Tetap Anies,https://twitter.com/Nasrullutfi3/status/1723043398125232631
"@BurhanMuhtadi Ganjar tertinggal, Prabowo melesat, Anies mengejar siapa pemenang sesungguhnya",https://twitter.com/st_whono/status/1723041563645755887
"Sampai hari ini, penilaian saya thdp para capres: - Ganjar: kurang berani, sedikit oportunis, tapi jiwanya baik, cukup pintar - Prabowo: Lantang, berani, tapi kurang bijak, cepat tersulut, nasionalis. - Anies: oportunis, pintar merangkai kata, kurang idealis, tapi cerdik",https://twitter.com/Bang_Jedi/status/1723031603205554372
"@law4npenipu4n @CNNIndonesia Itu buzzer auto komen bang yang sengaja di sebar sama pihak Prabowo, sederhana aja, mereka cari sensasi setiap postingan pak Anies doang biar ikutan2 nebeng pembahasan dari pak anies",https://twitter.com/adeliyaptr/status/1723030180254409159
"Di Pilpres kali ini andai terjadi 2 putaran saya akan dukung siapapun yg jadi lawan Prabowo, mau Ganjar atau Anies. Ayo lawan jangan biarkan kecurangan yg menjadi pemenang. https://t.co/8jG2NZYUgI",https://twitter.com/wisnu_aj1/status/1723030003326087386
"@tamrintomagola Sudah jadi sipil, bikin parpol, pencalonan disahkan KPU, lalu dipilih rakyat, apa itu belum cukup jadi ruwatan Prabowo Pak @tamrintomagola ? Atau seharusnya bagaimana? Atau mari kampanye untuk tidak milih Prabowo. Terus kita milih siapa? Ganjar apa Anies?",https://twitter.com/Jupri56024559/status/1723028949645558122
"Anies-Muhaimin unggul dari Ganjar-Mahfud di Sumatera, Jabar, DKI-BANTEN tapi masih di bawah #PrabowoGibranUnggul PemilihJokowi MakinPakbowo LanjutkanKemajuan UntukBangsa #PrabowoGibranIstimewa",https://twitter.com/KhoirilAnwar_/status/1723018493010833711
"MALUKU-PAPUA Anies-Muhaimin 26,3 % Ganjar-Mahfud 36,3 % Prabowo-Gibran 35 % Ganjar unggul dari #PrabowoGibran 1,3% PemilihJokowi MakinPakbowo LanjutkanKemajuan UntukBangsa #PrabowoGibranIstimewa",https://twitter.com/KhoirilAnwar_/status/1723018485943468486
"SULAWESI Anies-Muhaimin 23,3 % Ganjar-Mahfud 24,4 % Prabowo-Gibran 48,9 % #PrabowoGibranUnggul dari Ganjar 24,5% PemilihJokowi MakinPakbowo LanjutkanKemajuan UntukBangsa #PrabowoGibranIstimewa",https://twitter.com/KhoirilAnwar_/status/1723018482697347205
"KALIMANTAN, BALI, NTB NTT Anies-Muhaimin 17,9 % Ganjar-Mahfud 28,6 % Prabowo-Gibran 45 % #PrabowoGibranUnggul dari Ganjar 16,4% PemilihJokowi MakinPakbowo LanjutkanKemajuan UntukBangsa #PrabowoGibranIstimewa",https://twitter.com/KhoirilAnwar_/status/1723018479669059829
DKI-BANTEN Anies-Muhaimin 34 % Ganjar-Mahfud 19 % Prabowo-Gibran 46 % #PrabowoGibranUnggul dari Anies 12% PemilihJokowi MakinPakbowo LanjutkanKemajuan UntukBangsa #PrabowoGibranIstimewa,https://twitter.com/KhoirilAnwar_/status/1723018476321657074
"JAWA TENGAH-DIY Anies-Muhaimin 13,3 % Ganjar-Mahfud 53,3 % Prabowo-Gibran 27,2 % Ganjar unggul dari #PrabowoGibran 26,1% PemilihJokowi MakinPakbowo LanjutkanKemajuan UntukBangsa #PrabowoGibranIstimewa",https://twitter.com/KhoirilAnwar_/status/1723018473108807850
"JAWA TIMUR Anies-Muhaimin 17,8 % Ganjar-Mahfud 38,3 % Prabowo-Gibran 41,7 % #PrabowoGibranUnggul dari Ganjar 3,4% PemilihJokowi MakinPakbowo LanjutkanKemajuan UntukBangsa #PrabowoGibranIstimewa",https://twitter.com/KhoirilAnwar_/status/1723018470093463831
"JAWA BARAT Anies-Muhaimin 32,6 % Ganjar-Mahfud 25,8 % Prabowo-Gibran 39,5 % #PrabowoGibranUnggul dari Anies 6,9% PemilihJokowi MakinPakbowo LanjutkanKemajuan UntukBangsa #PrabowoGibranIstimewa",https://twitter.com/KhoirilAnwar_/status/1723018466989396417
"SUMATERA Anies-Muhaimin 30,4% Ganjar-Mahfud 16,9% Prabowo-Gibran 41,9% #PrabowoGibranUnggul dari Anies 11,5% PemilihJokowi MakinPakbowo LanjutkanKemajuan UntukBangsa #PrabowoGibranIstimewa",https://twitter.com/KhoirilAnwar_/status/1723018463243809171
"Survei Capres di Indonesia Barat, Tengah, Timur Versi Poltracking NASIONAL Anies-Muhaimin 24,4 % Ganjar-Mahfud 30,1 % Prabowo-Gibran 40,2 % #PrabowoGibranUnggul dari Ganjar 10,1% PemilihJokowi MakinPakbowo LanjutkanKemajuan UntukBangsa https://t.co/uaaA9DWnH3 https://t.co/mjk9RH0CFS",https://twitter.com/KhoirilAnwar_/status/1723018459678753254
@Tan_Mar3M Capres cm. Prabowo. Tapi yg paling pantas ya Pak Anies,https://twitter.com/Muhamma58213471/status/1723016047647989769
"Saya kalo jadi temen SD nya ganjar ini pasti iseng teriak saya cinta prabowo/ anies"" biar kaget wkwk. Kan temen SD, harusnya selow dong 😂""",https://twitter.com/IdaBagusAnggara/status/1723014165827367383
@99propaganda @Fahrihamzah @prabowo @Next_PS08 Ganjar bisa saja biaya dia lari antar kota antar propinsi mungkin dlm 1 bulan habis 5M tapi rasa itu tidak ada. Kalau Anies hanya bisa berkata² tanpa ada aksi nyata (NATO) Rakyat Palestina tidak butuh kata²,https://twitter.com/NoviBudi78/status/1723013554536870318
"Ending dari DRAMA BUSUK ini adalah Gibran Rakabuming Raka digantikan oleh sosok berinisial E"" Tujuan utamanya adalah menggagalkan Prabowo &amp Anies agar Petugas Partai saja yang pimpin Negara! #KrisyantoYenOni #AniesBaswedanOrangBaik #AMINPeduliPendidikan #AniesMuhaimin2024 https://t.co/xETc79Rfgi""",https://twitter.com/KrisyantoOni/status/1723013342758088998
"Rocky Gerung Mengaku Tahu Jalan Pikiran Anies dan Prabowo, Tapi Tidak dengan Ganjar https://t.co/k9WOby6S7D",https://twitter.com/RepelitaO/status/1723013150809997336
"@yusuf_dumdum Hahaha berharap bisa nyalip Prabowo, ga taunya dikit lagi malah kesalip Anies, mamaam tuh dum 🤣🤣",https://twitter.com/jacknovember24/status/1723011605842244078
@xquitavee Maksd dari ini prabowo jelas ko.cuma survei sebelah lagi ambrol jadi cari cari kesalahan.si anies malah lebih percaya survei dari prancis😭😭,https://twitter.com/meruramerura/status/1723011554226889114
"Maen maen ke tempat yang dukung ganjar , berbeda pendapat aja langsung di serang hahaha Dulu yang gini kan pendukungnya prabowo sm anies ya Skrg mrk malah diem aja 😂",https://twitter.com/cowoalpukat7/status/1723008298981449782
@NenkMonica @prabowo Jauh lebih berkelas pemaparan Pak Anies. 👍 #AMINAjaDulu 🤲,https://twitter.com/rahmaniarbaftim/status/1723000564882010206
"Dukung siapa 2024?"" Yg jelas gua ga golput, yg jelas bukan Anies, mutlak itu. Antara Prabowo dan Ganjar, gua ga peduli visi misi, gua cuma nunggu siapa di antara keduanya yang bersedia menjanjikan kursi menteri untuk Ibu Susi, atau menunggu siapa yg Ibu Susi dukung.""",https://twitter.com/kensmen/status/1723000465984508024
"Seandainya terjadi 2 putaran kyknya pendukung Anies bakalan byk yg golput, soalnya mo dukung Prabowo misinya beda, mo dukung Ganjar misinya juga beda.. Masa misi perubahan yg dibangga2kan mau dibuang begitu saja.. 🤔",https://twitter.com/M45Broo/status/1723000321494945991
"Alhamdulillah survei tatap muka Populi Center 29 Oktober-5 November 2023 Prabowo Gibran 43,1%, Ganjar Mahfud 23%, Anies Muhaimin 22,3%,"" kata Andre kepada wartawan, Kamis (9/11/2023). https://t.co/osO41iRSO3""",https://twitter.com/talangijoo/status/1722999923044454672
"Simulasi Putaran Kedua, Head to Head Prabowo Subianto/Gibran Rakabuming Raka 52,1% Ganjar Pranowo/Mahfud MD 41,5% Undecided Voters 6,4% Prabowo Subianto/Gibran Rakabuming Raka 58,5% Anies Baswedan/Muhaimin Iskandar 30,2% Undecided Voters 11,3%",https://twitter.com/autokrat_not/status/1722999618428920294
"Tingkat Elektabilitas Paslon jika Pilpres hari ini Prabowo Subianto/Gibran Rakabuming Raka 39,7% Ganjar Pranowo/Mahfud MD 34,8% Anies Baswedan/Muhaimin Iskandar 22,4% Undecided Voters 3,1%",https://twitter.com/autokrat_not/status/1722999613710364987
"Tiga Capres Soal Pasar Modal RI, Beda Strategi Anies – Ganjar dan Prabowo https://t.co/5bU2XLSOae",https://twitter.com/Jurnalpatroli_/status/1722999371044651285
"@nahdiyinbersatu Saya NU dari rahim… saya juga ingin Perubahan, tapi bukan dgn memilih Anies… Saya NU saya dari 99 juga selalu pilih PKB. untuk Pilpres ya pilih Pk Ganjarlah… Daripada Prabowo dan Anies ya pasti akal sehat lebih condong ke Ganjar…",https://twitter.com/AgusHamra/status/1722999024465084467
"@WinnerWave_ Pemilih Jokowi lbh banyak yg memutuskan tdk pilih ganjar dan terbanyak yg keluar dari Ganjar itu masuk ke Prabowo Gibran. Sementara pemilih Prabowo Sandi lbh banyak menetap, dan sedikit sekali yg pindah ke Ganjar. Intinya Prabowo menang banyak kali ini, Anies gak masuk itungan.",https://twitter.com/Technospeed/status/1722998917267161538
"Simulasi Putaran Kedua, Head to Head Prabowo Subianto/Gibran Rakabuming Raka 52,1% Ganjar Pranowo/Mahfud MD 41,5% Undecided Voters 6,4% Prabowo Subianto/Gibran Rakabuming Raka 58,5% Anies Baswedan/Muhaimin Iskandar 30,2% Undecided Voters 11,3%",https://twitter.com/DKliktivisme/status/1722998620226572317
"Tingkat Elektabilitas Paslon jika Pilpres hari ini Prabowo Subianto/Gibran Rakabuming Raka 39,7% Ganjar Pranowo/Mahfud MD 34,8% Anies Baswedan/Muhaimin Iskandar 22,4% Undecided Voters 3,1%",https://twitter.com/DKliktivisme/status/1722998616011182338
@PartaiSocmed Yaa gimana yaa Anies ini benar-benar turun ke akar rumput dengan keliling daerah terus. Beda sama Ganjar sama Prabowo yang lebih cari dukungan elit politik,https://twitter.com/soon15ucl/status/1722998448218149249
"Simulasi Putaran Kedua, Head to Head Prabowo Subianto/Gibran Rakabuming Raka 52,1% Ganjar Pranowo/Mahfud MD 41,5% Undecided Voters 6,4% Prabowo Subianto/Gibran Rakabuming Raka 58,5% Anies Baswedan/Muhaimin Iskandar 30,2% Undecided Voters 11,3%",https://twitter.com/indeks_politika/status/1722997829013057587
"Tingkat Elektabilitas Paslon jika Pilpres hari ini Prabowo Subianto/Gibran Rakabuming Raka 39,7% Ganjar Pranowo/Mahfud MD 34,8% Anies Baswedan/Muhaimin Iskandar 22,4% Undecided Voters 3,1%",https://twitter.com/indeks_politika/status/1722997823925346349
"Survei Poltracking Terbaru Elektabilitas Tiga Capres: Prabowo dan Anies Naik, Ganjar Turun https://t.co/ye4lN64m4k",https://twitter.com/eradotid/status/1722997555536220561
@BangPino__ Ini Survei prancis tetap Prabowo menang. Kok bisa . Padahal Anies Tumpah ruah kalau kampanye. Jgn jgn survei dari prancis sudah disogok juga. Yg benar Y'ang mana SIh.,https://twitter.com/daengmatarang/status/1722997024256143484
"Simulasi Putaran Kedua, Head to Head Prabowo Subianto/Gibran Rakabuming Raka 52,1% Ganjar Pranowo/Mahfud MD 41,5% Undecided Voters 6,4% Prabowo Subianto/Gibran Rakabuming Raka 58,5% Anies Baswedan/Muhaimin Iskandar 30,2% Undecided Voters 11,3%",https://twitter.com/politikngaji2/status/1722996774443311584
"Simulasi Putaran Kedua, Head to Head Prabowo Subianto/Gibran Rakabuming Raka 52,1% Ganjar Pranowo/Mahfud MD 41,5% Undecided Voters 6,4% Prabowo Subianto/Gibran Rakabuming Raka 58,5% Anies Baswedan/Muhaimin Iskandar 30,2% Undecided Voters 11,3%",https://twitter.com/Suarajelata1/status/1722996770978849150
"Tingkat Elektabilitas Paslon jika Pilpres hari ini Prabowo Subianto/Gibran Rakabuming Raka 39,7% Ganjar Pranowo/Mahfud MD 34,8% Anies Baswedan/Muhaimin Iskandar 22,4% Undecided Voters 3,1%",https://twitter.com/politikngaji2/status/1722996770555187306
"Tingkat Elektabilitas Paslon jika Pilpres hari ini Prabowo Subianto/Gibran Rakabuming Raka 39,7% Ganjar Pranowo/Mahfud MD 34,8% Anies Baswedan/Muhaimin Iskandar 22,4% Undecided Voters 3,1%",https://twitter.com/Suarajelata1/status/1722996685452833275
Kelihatan nyata lembaga survei pesanan dan bayaran. Faktanya elektabilitas Prabowo Gibran itu jatuh di bawah posisi Anies,https://twitter.com/_G03NT03R_/status/1722996272225771890
"Rocky Gerung Mengaku Tahu Jalan Pikiran Anies dan Prabowo, Tapi Tidak dengan Ganjar https://t.co/VxbKxzWu8s",https://twitter.com/idtodaycoid/status/1722994102743011442
"@G0mb4k @BANGSAygSUJUD @bengkeldodo @Alexemeru @alextham878 @Dulure_Gibran @KhoirilAnwar_ @Lembayung071 @tinggipasaribu @99propaganda @Papa_Brewook Lha, kau ini penjilat Prabowo atau penjilat Anies? Bingung aku. 😄😄😄",https://twitter.com/andrian_kaifan/status/1722992250131509593
"@CNNIndonesia Meski gw bkan pendukung pak anies tp gw salut sma 2 org ini. mereka bener2 membicarakan rencana program beda sama buzzernya Gama yg suka nyerang sana sini. Lain lagi prabowo yg kalem2 wae. Tp gw milih golput ajalah, g ngaruh jga suara gw 😂😂😂😂",https://twitter.com/Gembo_cg/status/1722991679479628201
"@txtpegawaipajak sama aja, buzzer anies dan prabowo nggak kalah gila.",https://twitter.com/tommiyes/status/1722990192938655800
"Rocky Gerung Mengaku Tahu Jalan Pikiran Anies dan Prabowo, Tapi Tidak dengan Ganjar https://t.co/dEXVg3qIBb",https://twitter.com/OposisiCerdas/status/1722989204114690151
"Simulasi Putaran Kedua, Head to Head Prabowo Subianto/Gibran Rakabuming Raka 52,1% Ganjar Pranowo/Mahfud MD 41,5% Undecided Voters 6,4% Prabowo Subianto/Gibran Rakabuming Raka 58,5% Anies Baswedan/Muhaimin Iskandar 30,2% Undecided Voters 11,3%",https://twitter.com/irmajahsa88687/status/1722988923700347238
"Tingkat Elektabilitas Paslon jika Pilpres hari ini Prabowo Subianto/Gibran Rakabuming Raka 39,7% Ganjar Pranowo/Mahfud MD 34,8% Anies Baswedan/Muhaimin Iskandar 22,4% Undecided Voters 3,1%",https://twitter.com/irmajahsa88687/status/1722988916624478568
"//Pasangan Prabowo-Gibran Tetap Mendominasi dalam Elektabilitas Menurut Survei PWS // Survei Terbaru PWS Simulasi Tiga Nama, Prabowo-Gibran 39,7% Gnajar - Mahfud 34,8% Anies Muhaimin 22,4% https://t.co/jajgfPbZWz",https://twitter.com/irmajahsa88687/status/1722988822764371984
"@Tumpas_Mukidi @yusufagro @prabowo @AditBandit234 @alextham878 @Alie_Fahnoor @askencana @azizi_khusnul @BANGSAygSUJUD @Bank_Joee_ @Chaves1305 @Kimberley_2024 Kalau tidak memilih si Anies, akan masuk neraka kah om ?",https://twitter.com/AlmaghribiS/status/1722988744695804368
"Simulasi Putaran Kedua, Head to Head Prabowo Subianto/Gibran Rakabuming Raka 52,1% Ganjar Pranowo/Mahfud MD 41,5% Undecided Voters 6,4% Prabowo Subianto/Gibran Rakabuming Raka 58,5% Anies Baswedan/Muhaimin Iskandar 30,2% Undecided Voters 11,3%",https://twitter.com/NurIrma98882/status/1722987449255698902
"Tingkat Elektabilitas Paslon jika Pilpres hari ini Prabowo Subianto/Gibran Rakabuming Raka 39,7% Ganjar Pranowo/Mahfud MD 34,8% Anies Baswedan/Muhaimin Iskandar 22,4% Undecided Voters 3,1%",https://twitter.com/NurIrma98882/status/1722987440351117798
"//Pasangan Prabowo-Gibran Tetap Mendominasi dalam Elektabilitas Menurut Survei PWS // Survei Terbaru PWS Simulasi Tiga Nama, Prabowo-Gibran 39,7% Gnajar - Mahfud 34,8% Anies Muhaimin 22,4% https://t.co/ESQk4K2P2y",https://twitter.com/NurIrma98882/status/1722987355282264548
@javaceh @Fahrihamzah @prabowo Nanya nya ganjar dan anies dong nyumbang apa engga biar apple to apple. Capres vs capres. Bodo dipelihara.,https://twitter.com/coldbrew165/status/1722986947033837749
"Hasil pantauan konten2 tiktok yg berseliweran mengenai pilihan presiden, sprtinya memang prabowo yg unggul. Ganjar dan Anies imbang. Di bbrp sampel kampus, trmsk kampus reformasi trisakti, Prabowo menang. Sekian.",https://twitter.com/dannykob/status/1722985804622860406
"Rocky Gerung Mengaku Tahu Jalan Pikiran Anies dan Prabowo, Tapi Tidak dengan Ganjar https://t.co/wtTHQzFBCt",https://twitter.com/polhukamid_/status/1722985732178887057
"Prabowo Subianto/Gibran Rakabuming Raka 52,1% Ganjar Pranowo/Mahfud MD 41,5% Undecided Voters 6,4% Prabowo Subianto/Gibran Rakabuming Raka 58,5% Anies Baswedan/Muhaimin Iskandar 30,2% Undecided Voters 11,3%",https://twitter.com/NurirmaJ93483/status/1722985470987063451
"Tingkat Elektabilitas Paslon jika Pilpres hari ini Prabowo Subianto/Gibran Rakabuming Raka 39,7% Ganjar Pranowo/Mahfud MD 34,8% Anies Baswedan/Muhaimin Iskandar 22,4% Undecided Voters 3,1% Simulasi Putaran Kedua, Head to Head",https://twitter.com/NurirmaJ93483/status/1722985465760911762
"//Pasangan Prabowo-Gibran Tetap Mendominasi dalam Elektabilitas Menurut Survei PWS // Survei Terbaru PWS Simulasi Tiga Nama, Prabowo-Gibran 39,7% Gnajar - Mahfud 34,8% Anies Muhaimin 22,4% https://t.co/GV3HDUxalW",https://twitter.com/NurirmaJ93483/status/1722985383644864880
"Rocky Gerung Mengaku Tahu Jalan Pikiran Anies dan Prabowo, Tapi Tidak dengan Ganjar https://t.co/vL3wwBIS69",https://twitter.com/geloradotnews/status/1722985320600236452
"7 hasil survei capres cawapres 2024: Anies-Cak Imin konsisten, Prabowo-Gibran dan Ganjar-Mahmud MD bersaing ketat. #TribunKaltim #Pilpres2024 #SurveiCapres #Anies #Ganjar #Prabowo https://t.co/xf2QYlrioW lewat @tribunnews",https://twitter.com/tribunkaltim/status/1722985079712956454
"@Rjnhwa 😭WKWKWKWK FCK ANIES, ATAU PRABOWO. TETEP MINGHAO PRANOWO DIHATI",https://twitter.com/gyuwwlie/status/1722984289665470694
"Prabowo Subianto/Gibran Rakabuming Raka 52,1% Ganjar Pranowo/Mahfud MD 41,5% Undecided Voters 6,4% Prabowo Subianto/Gibran Rakabuming Raka 58,5% Anies Baswedan/Muhaimin Iskandar 30,2% Undecided Voters 11,3%",https://twitter.com/Positivevi47750/status/1722984110832943573
"Tingkat Elektabilitas Paslon jika Pilpres hari ini Prabowo Subianto/Gibran Rakabuming Raka 39,7% Ganjar Pranowo/Mahfud MD 34,8% Anies Baswedan/Muhaimin Iskandar 22,4% Undecided Voters 3,1% Simulasi Putaran Kedua, Head to Head",https://twitter.com/Positivevi47750/status/1722984106009542844
"//Pasangan Prabowo-Gibran Tetap Mendominasi dalam Elektabilitas Menurut Survei PWS // Survei Terbaru PWS Simulasi Tiga Nama, Prabowo-Gibran 39,7% Gnajar - Mahfud 34,8% Anies Muhaimin 22,4% https://t.co/M78xk5pUEE",https://twitter.com/Positivevi47750/status/1722984036291752423
"Rocky Gerung Mengaku Tahu Jalan Pikiran Anies dan Prabowo, Tapi Tidak dengan Ganjar https://t.co/96lyNGYf3q",https://twitter.com/geloraco/status/1722983597550739839
"@ch_chotimah2 Sudahlah kalian semua jangan pada brisik, si prabowo dan si anies tidak bakal menang, GANJAR yg akan jadi PRESIDEN RI 2024 - 2029. Kalian beraktivitas seperti sediakala saja déh. Cari nafkah utk keluarga.",https://twitter.com/WidhartaArie/status/1722983483478512105
