tweet,tweet_url
"Golkar DIY Dukung Statemen Presiden Jokowi, Pemilu Ajang Adu .. - warta jogja https://t.co/63pJeDfj1T #Jokowinomics #MenataMasaDepan #PrabowoPetugasRakyat",https://twitter.com/RondangKomariah/status/1721792743465496794
"Semoga dengan rasa sayang dan cinta Mas Gibran dan PSI juga menang besar di NTT pada pemilu yang akan datang, kata Kaesang di Kupang, NTT, Minggu (29/10/2023).#PrabowoGibranIstimewa #BersamaIndonesiaMaju #PrabowoGemoy Prabowo Subianto""",https://twitter.com/mingskyyy_/status/1721792092752711996
Ia berharap PSI dan Prabowo-Gibran dapat menang di NTT pada pemilu 2024 mendatang.#PrabowoGibranIstimewa #BersamaIndonesiaMaju #PrabowoGemoy Prabowo Subianto,https://twitter.com/mingskyyy_/status/1721792086616555977
"Rakyat Merdeka - Lembaga survei PatraData Research Consulting merilis temuan terbaru mengenai elektabilitas capres jelang Pemilu 2024, Kamis (2/11). #BersamaIndonesiaMaju #PrabowoGibranIstimewa #PrabowoGemoy Prabowo Subianto",https://twitter.com/harrispradana_/status/1721792073534415275
@Gi_N0ng @prabowo Ga usah bawa² Tuhan Yesus untuk Politik Cukup Pilkada Dki Jakarta 2017 begitu suram jangan sampai Pemilu 2024 gunakan cara² Licik,https://twitter.com/PenculikBangsat/status/1721792053942874537
bakal capres-cawapres Prabowo Subianto-Gibran Rakabuming Raka pada Pemilu 2024. #MenataMasaDepan #BersamaPrabowoGibran #PrabowoGemoy Prabowo Gibran,https://twitter.com/muhammad_kummul/status/1721792006610096142
"Rakyat Merdeka - Lembaga survei PatraData Research Consulting merilis temuan terbaru mengenai elektabilitas capres jelang Pemilu 2024, Kamis (2/11). #BersamaIndonesiaMaju #PrabowoGibranIstimewa #PrabowoGemoy Prabowo Subianto",https://twitter.com/harrispradana_/status/1721791698563727828
"Rakyat Merdeka - Lembaga survei PatraData Research Consulting merilis temuan terbaru mengenai elektabilitas capres jelang Pemilu 2024, Kamis (2/11). #BersamaIndonesiaMaju #PrabowoGibranIstimewa #PrabowoGemoy Prabowo Subianto",https://twitter.com/harrispradana_/status/1721791329313992974
"@vinirahmawatii Prabowo-Gibran di Pemilu 2024, janji kesejahteraan melalui pangan! dekade08",https://twitter.com/yudilasukmasari/status/1721791123080061342
"@narkosun melihat begitu asyik dan menariknya kampanye tim prabowo..kok aku yakin prabowo bakal menang dengan mudah di pemilu 2024..sedangkan, tim e ganjar..pemilu tinggal bbrp bulan, bukn e bikin kampanye yng menarik.tp narasine panggah kuwi kuwi wae..opo ancen wes kroso ape kalah.",https://twitter.com/sudsalesman/status/1721791011180175806
"Rakyat Merdeka - Lembaga survei PatraData Research Consulting merilis temuan terbaru mengenai elektabilitas capres jelang Pemilu 2024, Kamis (2/11). #BersamaIndonesiaMaju #PrabowoGibranIstimewa #PrabowoGemoy Prabowo Subianto",https://twitter.com/harrispradana_/status/1721790964669481228
"Rakyat Merdeka - Lembaga survei PatraData Research Consulting merilis temuan terbaru mengenai elektabilitas capres jelang Pemilu 2024, Kamis (2/11). #BersamaIndonesiaMaju #PrabowoGibranIstimewa #PrabowoGemoy Prabowo Subianto",https://twitter.com/harrispradana_/status/1721790815385899473
"Rakyat Merdeka - Lembaga survei PatraData Research Consulting merilis temuan terbaru mengenai elektabilitas capres jelang Pemilu 2024, Kamis (2/11). #BersamaIndonesiaMaju #PrabowoGibranIstimewa #PrabowoGemoy Prabowo Subianto",https://twitter.com/harrispradana_/status/1721790614965203396
"Rakyat Merdeka - Lembaga survei PatraData Research Consulting merilis temuan terbaru mengenai elektabilitas capres jelang Pemilu 2024, Kamis (2/11). #BersamaIndonesiaMaju #PrabowoGibranIstimewa #PrabowoGemoy Prabowo Subianto",https://twitter.com/harrispradana_/status/1721790438548570350
"Rakyat Merdeka - Lembaga survei PatraData Research Consulting merilis temuan terbaru mengenai elektabilitas capres jelang Pemilu 2024, Kamis (2/11). #BersamaIndonesiaMaju #PrabowoGibranIstimewa #PrabowoGemoy Prabowo Subianto",https://twitter.com/harrispradana_/status/1721790294243606578
"Rakyat Merdeka - Lembaga survei PatraData Research Consulting merilis temuan terbaru mengenai elektabilitas capres jelang Pemilu 2024, Kamis (2/11). #BersamaIndonesiaMaju #PrabowoGibranIstimewa #PrabowoGemoy Prabowo Subianto",https://twitter.com/harrispradana_/status/1721790069332455441
"Saya siap mendukung pak Prabowo Subianto di Pemilu 2024 Saya, bersama dengan jutaan rakyat Indonesia lainnya, bergabung mendukung Prabowo Subianto untuk memenangkan Pemilu 2024. Dengan menandatangani petisi https://t.co/xnWu92fgN5",https://twitter.com/Indahmustofa21/status/1721789978471178481
pilihan mereka jika Pilpres diadakan hari ini. Suara masyarakat diharapkan menjadi faktor penting dalam menentukan hasil akhir pemilu. #PrabowoGemoy #PrabowoGibranIstimewa #BersamaIndonesiaMaju Prabowo Subianto,https://twitter.com/sitikomariah032/status/1721787407408976081
prabowo culass tcihh pernah nudhh pemilu curang tapi gamau ngasih bukti ke MK🙊. skrg tetiba jg angkat biacara soal putusan batas usia capres cawapres🙊 #PamanGibranCurang https://t.co/IZGLOBeQKW,https://twitter.com/prettiestdumber/status/1721786791404134752
"Pilpres 2024 akan semakin ketat dalam beberapa bulan ke depan. Hal itu akan membuat para kandidat akan berusaha untuk meningkatkan elektabilitasnya agar dapat memenangkan pemilu,"" kata Ferry. #PrabowoGemoy #PrabowoGibranIstimewa #BersamaIndonesiaMaju Prabowo Subianto""",https://twitter.com/sitikomariah032/status/1721786184744214665
"Kampanye Pilpres 2024 diharapkan semakin ketat dalam beberapa bulan ke depan, dengan para kandidat berusaha meningkatkan elektabilitas mereka untuk memenangkan pemilu. #PrabowoGemoy #PrabowoGibranIstimewa #BersamaIndonesiaMaju Prabowo Subianto",https://twitter.com/sitikomariah032/status/1721786181099344267
Ferry menekankan bahwa hasil polling ini hanyalah gambaran awal dan bahwa hasil pemilu sesungguhnya dapat berbeda tergantung pada perkembangan politik dan ekonomi di Indonesia. #PrabowoGemoy #PrabowoGibranIstimewa #BersamaIndonesiaMaju Prabowo Subianto,https://twitter.com/sitikomariah032/status/1721786177332928972
TIMES Indonesia merilis hasil polling calon presiden dan wakil presiden pilihan netizen pada Pemilu 2024. Dalam polling batch I pada 26 Oktober hingga 5 November 2023 #PrabowoGemoy #PrabowoGibranIstimewa #BersamaIndonesiaMaju Prabowo Subianto,https://twitter.com/sitikomariah032/status/1721786157946790271
"Bhabinkamtibmas Desa Ciluncat Polsek Cangkuang Polresta Bandung, melaksanakan Sosialisasi Pemilu Damai 2024 .. @listyosigitprabowo @divisihumaspolri @humaspoldajabar #PolrestaBandung #polripresisi #POLISIPENOLONGPRESISI #PoldaJabar_07 @polrestabandung @kapolresta_bandung https://t.co/pVrzIqhUv1",https://twitter.com/PolsekCangkuang/status/1721786157107958106
"JAKARTA – Hasil polling TIMES Indonesia Batch I untuk Pemilu 2024 menunjukkan Prabowo Subianto-Gibran Rakabuming Raka memimpin, disusul oleh Ganjar Pranowo-Mahfud MD dan Anies Baswedan-Muhaimin Iskandar. #PrabowoGemoy #PrabowoGibranIstimewa #BersamaIndonesiaMaju Prabowo Subianto",https://twitter.com/sitikomariah032/status/1721786154394239125
@CNNIndonesia Lah bukanlah di MK pun sedang terjadi drama seperti drama mkmk setelah itu ketua MK yang diberhentikan akan banding dan menang dan akan kembali menjadi Hakim untuk sengketa Pemilu 2024 di MK dan intinya semua hanyalah drama tapi Gibran tetap bisa maju jadi cawapres Prabowo,https://twitter.com/haidar_arash68/status/1721783671538278454
"Gibran Tak Hadiri HUT Golkar, Airlangga: Sudah Diwakilkan Prabowo dan Jokowi - Pemilu https://t.co/qSLYbMFm2Q",https://twitter.com/RelawanMonas/status/1721781061737419212
"Gibran Tak Hadiri HUT Golkar, Airlangga: Sudah Diwakilkan Prabowo dan Jokowi - Pemilu https://t.co/u3af4KaYvq https://t.co/RQ2Y8bMDbU #Jokowinomics #MenataMasaDepan #PrabowoPetugasRakyat",https://twitter.com/AzhareAkiba/status/1721778032699208150
"Gibran Tak Hadiri HUT Golkar, Airlangga: Sudah Diwakilkan Prabowo dan Jokowi - Pemilu https://t.co/xlu2FhHNxi https://t.co/izhPhom2bt #Jokowinomics #MenataMasaDepan #BersamaPrabowo",https://twitter.com/Jason20865405/status/1721778030975259035
@Arietakduts @FaGtng SKENARIO AWAL - PRABOWO di DUET kan DNG GANJAR - PDIP MENOLAK sbg Cawapres KARENA sbg PEMENANG PEMILU 2019 Jadi PDIP MINTA CALONnya SBG Capres /PRESIDEN ! Jokowi merasa tdk kuat berlindung di bawah Ganjar - sehingga skenario berubah Dinasti GIbran masuk ke Cawapres Parbowo,https://twitter.com/IrdinaPoy/status/1721777365125369931
"Mahkamah Konstitusi (MK) mengabulkan gugatan judicial review UU Pemilu. Putusan itu dianggap konspiratif karena memuluskan jalan Gibran Rakabuming Raka, anak Presiden Jokowi sekaligus keponakan Ketua MK Anwar Usman untuk maju dalam pemilu bersama Prabowo Subianto. https://t.co/f7bOo1iXAO",https://twitter.com/pyogaapriandi/status/1721777172711633323
"2014 saat mantan relawan ada yg menuduh prabowo pro israel dan mantan relawan yg lain menuduh prabowo pro teroris dengan membela palestina. Mendekati pemilu 2024, kalian muncul lagi dengan narasi yg sama. Ingat ini : https://t.co/ihY24GhZyt https://t.co/q4CLAX8chV",https://twitter.com/Royan_02/status/1721776046314524955
"Kukuhkan Semeton Anti Money Politic, Gus Adhi Ajak Masyarakat Cegah Kecurangan di Pemilu 2024 #airlanggahartarto #kuningkeren #PrabowoGibran #partaigolkar #golkarpedia https://t.co/o7PD95ynfw",https://twitter.com/golkarpedia/status/1721769197154300087
"Hingga hari Jumat, mantan komandan pasukan khusus ini belum mendaftar untuk pemilu bulan Februari yang akan menentukan siapa yang akan memimpin Indonesia dan menggantikan Joko Widodo #BersamaIndonesiaMaju #PrabowoGibranIstimewa #PrabowoGemoy Prabowo Subianto",https://twitter.com/Ninaang06470572/status/1721768940819583450
Ia masih mengungguli Ganjar Pranowo dari partai berkuasa dengan hanya selisih tipis saat musim pemilu dimulai. #BersamaIndonesiaMaju #PrabowoGibranIstimewa #PrabowoGemoy Prabowo Subianto,https://twitter.com/Ninaang06470572/status/1721768938084966437
"Bhabinkamtibmas Desa Ciluncat Polsek Cangkuang Polresta Bandung, Sosialisasi Pemilu Damai 2024 .. @listyosigitprabowo @divisihumaspolri @humaspoldajabar #PolrestaBandung #polripresisi #POLISIPENOLONGPRESISI #PoldaJabar_07 @polrestabandung @kapolresta_bandung https://t.co/gjyGLo3tvn",https://twitter.com/PolsekCangkuang/status/1721766576389824587
pilihan mereka jika Pilpres diadakan hari ini. Suara masyarakat diharapkan menjadi faktor penting dalam menentukan hasil akhir pemilu. #PrabowoGemoy #PrabowoGibranIstimewa #BersamaIndonesiaMaju Prabowo Subianto,https://twitter.com/manaf_ramli/status/1721766288190820525
"Pilpres 2024 akan semakin ketat dalam beberapa bulan ke depan. Hal itu akan membuat para kandidat akan berusaha untuk meningkatkan elektabilitasnya agar dapat memenangkan pemilu,"" kata Ferry. #PrabowoGemoy #PrabowoGibranIstimewa #BersamaIndonesiaMaju Prabowo Subianto""",https://twitter.com/manaf_ramli/status/1721765802444247347
"Kampanye Pilpres 2024 diharapkan semakin ketat dalam beberapa bulan ke depan, dengan para kandidat berusaha meningkatkan elektabilitas mereka untuk memenangkan pemilu. #PrabowoGemoy #PrabowoGibranIstimewa #BersamaIndonesiaMaju Prabowo Subianto",https://twitter.com/manaf_ramli/status/1721765797276876852
Ferry menekankan bahwa hasil polling ini hanyalah gambaran awal dan bahwa hasil pemilu sesungguhnya dapat berbeda tergantung pada perkembangan politik dan ekonomi di Indonesia. #PrabowoGemoy #PrabowoGibranIstimewa #BersamaIndonesiaMaju Prabowo Subianto,https://twitter.com/manaf_ramli/status/1721765793237803184
TIMES Indonesia merilis hasil polling calon presiden dan wakil presiden pilihan netizen pada Pemilu 2024. Dalam polling batch I pada 26 Oktober hingga 5 November 2023 #PrabowoGemoy #PrabowoGibranIstimewa #BersamaIndonesiaMaju Prabowo Subianto,https://twitter.com/manaf_ramli/status/1721765771460980958
"JAKARTA – Hasil polling TIMES Indonesia Batch I untuk Pemilu 2024 menunjukkan Prabowo Subianto-Gibran Rakabuming Raka memimpin, disusul oleh Ganjar Pranowo-Mahfud MD dan Anies Baswedan-Muhaimin Iskandar. #PrabowoGemoy #PrabowoGibranIstimewa #BersamaIndonesiaMaju Prabowo Subianto",https://twitter.com/manaf_ramli/status/1721765766058655918
Dilarang menyerang personal. Tunjukkan saja kualitasmu. Itulah yg terbaik. Setelah memantau pergerakan media sosial.. Ternyata pemilu 2014/2019 Yg banyak buzzer partai bukan orangnya.. 🤣🤣 baru tau. @ganjarpranowo @gibran_tweet @prabowo @mohmahfudmd,https://twitter.com/dfatmawati52/status/1721760571891261900
"@saifulmujani @muchlis_ar @saidiman @saiful_mujani Hasil survei SMRC 45 % buat Prabowo, tanggung amat bikin aja 55 % , kan lnsg menang, .. anggaran lagsg cair. Ngk usah ada pemilu",https://twitter.com/okingpangestu1/status/1721760195448283632
"@v_algani Prabowo-Gibran di Pemilu 2024, janji kesejahteraan melalui pangan! dekade08",https://twitter.com/yudilasukmasari/status/1721759128362893337
@ybe_id @Official_PAN @ZUL_Hasan @hattarajasa @AsmanAbnur @BimaAryaS Adanya partai PAN sangat penting dalam ikut mensuskeskan pasangan prabowo-gibran melaju pemilu 2024,https://twitter.com/wisnuadria18228/status/1721756834598650307
"@Paltiwest Disurvei itu juga kesukaan Publik terhadap Pak Jokowi masih 75%, turun 5% aja. Dari 75% itu 30% aja mengikuti arahan utk memilih Prabowo-Gibran, wah Pemilu beneran cuma 1 putaran utk kemenangan Prabowo-Gibran.",https://twitter.com/Djojodiningrat_/status/1721756818140176540
"Berdasarkan data KPU, di Banten terdapat 8,8 juta pemilih Pemilu 2024. #BersamaIndonesiaMaju #PrabowoGibranIstimewa #PrabowoGemoy Prabowo Subianto",https://twitter.com/erick140451997/status/1721754648099553656
"Komisi Pemilihan Umum (KPU) telah menerima pendaftaran tiga pasangan bakal capres-cawapres untuk Pemilu 2024, #BersamaIndonesiaMaju #PrabowoGibranIstimewa #PrabowoGemoy Prabowo Subianto",https://twitter.com/erick140451997/status/1721754275662168266
"Ratusan petani di Kabupaten Bojonegoro, Jawa Timur, mendeklarasikan dukungan kepada pasangan bakal capres-cawapres Prabowo Subianto-Gibran Rakabuming Raka pada Pemilu 2024. #BersamaIndonesiaMaju #PrabowoGibranIstimewa #PrabowoGemoy Prabowo Subianto",https://twitter.com/erick140451997/status/1721754239901528228
"menjelaskan pada masyarakat Depok biar mengetahui secara jelas dan benar, jadi tidak keliru,” tegas Hamzah yang juga menjabat sebagai Ketua Badan Pemenangan Pemilu (Bappilu) Gerindra Kota Depok. #BersamaIndonesiaMaju #PrabowoGibranIstimewa #PrabowoGemoy Prabowo Subianto",https://twitter.com/erick140451997/status/1721753092495183911
"@BangPakat Api kebencian emang hrs dibarakan utk mendulang suara di satu kubu. Kubu yg lain lbh mengdpnkan persatuan dan merangkul rival stlh kompetisi pemilu lalu, spt yg diteladani Jokowi dan Prabowo Silahkan rakyat menilai mau bergabung ke gerbong mn utk kedpnnya menuju Indonesia Emas",https://twitter.com/AB5589RB/status/1721751788330897775
"@Adiprayitno_20 Jika mkmk membatalkan putusan mk,, apa yg terjadi dengan prabowo gibran sesuai uu pemilu??",https://twitter.com/APalloeppy/status/1721749575986450469
MILENIAL &amp GEN-Z TERBANYAK DI PEMILU 2024 PilihanSejuk PilihnyaPakbowo AsiknyaSih AmaMasgibran #PrabowoSubianto #GibranRakabuming #PrabowoGibran2024 #PrabowoGibranIstimewa Pada pemilu 2024 nanti generasi Milenial &amp Gen-Z menjadi peserta paling banyak dalam sejarah pemilu… https://t.co/MFUyhExbuA,https://twitter.com/yosephrosario_/status/1721749148096229804
pilihan mereka jika Pilpres diadakan hari ini. Suara masyarakat diharapkan menjadi faktor penting dalam menentukan hasil akhir pemilu. #PrabowoGemoy #PrabowoGibranIstimewa #BersamaIndonesiaMaju Prabowo Subianto,https://twitter.com/HeryWP/status/1721747021437284782
"Pilpres 2024 akan semakin ketat dalam beberapa bulan ke depan. Hal itu akan membuat para kandidat akan berusaha untuk meningkatkan elektabilitasnya agar dapat memenangkan pemilu,"" kata Ferry. #PrabowoGemoy #PrabowoGibranIstimewa #BersamaIndonesiaMaju Prabowo Subianto""",https://twitter.com/HeryWP/status/1721746437426561397
"Kampanye Pilpres 2024 diharapkan semakin ketat dalam beberapa bulan ke depan, dengan para kandidat berusaha meningkatkan elektabilitas mereka untuk memenangkan pemilu. #PrabowoGemoy #PrabowoGibranIstimewa #BersamaIndonesiaMaju Prabowo Subianto",https://twitter.com/HeryWP/status/1721746433454604661
Ferry menekankan bahwa hasil polling ini hanyalah gambaran awal dan bahwa hasil pemilu sesungguhnya dapat berbeda tergantung pada perkembangan politik dan ekonomi di Indonesia. #PrabowoGemoy #PrabowoGibranIstimewa #BersamaIndonesiaMaju Prabowo Subianto,https://twitter.com/HeryWP/status/1721746429201526860
TIMES Indonesia merilis hasil polling calon presiden dan wakil presiden pilihan netizen pada Pemilu 2024. Dalam polling batch I pada 26 Oktober hingga 5 November 2023 #PrabowoGemoy #PrabowoGibranIstimewa #BersamaIndonesiaMaju Prabowo Subianto,https://twitter.com/HeryWP/status/1721746407470801219
"JAKARTA – Hasil polling TIMES Indonesia Batch I untuk Pemilu 2024 menunjukkan Prabowo Subianto-Gibran Rakabuming Raka memimpin, disusul oleh Ganjar Pranowo-Mahfud MD dan Anies Baswedan-Muhaimin Iskandar. #PrabowoGemoy #PrabowoGibranIstimewa #BersamaIndonesiaMaju Prabowo Subianto",https://twitter.com/HeryWP/status/1721746401758179797
Prabowo-Gibran Konsisten Menang Lawan Paslon Lain! Lagi-lagi lembaga survei menyatakan pasangan capres dan cawapren Prabowo-Gibran konsisten untuk menang pemilu 2024 PilihanSejuk PilihnyaPakbowo AsiknyaSih AmaMasgibran #PrabowoSubianto #GibranRakabuming #PrabowoGibran2024… https://t.co/R8nxdStv0S,https://twitter.com/yosephrosario_/status/1721740905210904671
"Semangat kaka Zita, Mas Eko, dkk . semoga sukses pemilu 2024, prabowo presiden #zulhas #zulkiflihasan #partaiamanatnasional https://t.co/HYJ3ZXeBhS",https://twitter.com/STempe21221/status/1721738544295886983
"@Paltiwest Knp ga berani pecat? Krn mereka tahu mereka yg salah, org klo prabowo ganjar jd satu pemilu ini uda selesai menang pasti, malah gontok gontokan… itu yg diinginkan jokowi kayaknya, bersatu. Pdip tahu mereka yg salah makanya ga berani mecat keluarga jokowi.",https://twitter.com/m8deman/status/1721735270327099488
@Dennysiregar7 PEMILU KALI INI PERTARUNGAN GANJAR MAHFUD dengan KEKUATAN RAKYAT vs PRABOWO GIBRAN dengan ALAT NEGARA &amp KEKUASAAN..,https://twitter.com/philipus_de/status/1721732904009818385
Penculikan aktivis 97/98 adalah peristiwa penghilangan orang secara paksa atau penculikan terhadap para aktivis pro-demokrasi yang terjadi menjelang pelaksanaan Pemilihan Umum (Pemilu) tahun 97 dan Sidang Umum Majelis Permusyawaratan Rakyat (MPR) tahun 98. #PrabowoMelanggarHAM https://t.co/6VQZdnKN6N,https://twitter.com/mqemutar/status/1721729104314237184
"Sebelumnya, MKMK menemukan adanya tanda-tanda pelanggaran kode etik oleh 9 hakim yang mengesahkan perubahan UU Pemilu tentang syarat capres-cawapres kepala daerah. Putusan yang dibuat h-3 pendaftaran capres-cawapres, tentu membuka jalan buat Gibran maju mendampingi Prabowo. https://t.co/bTe3RVGBqr",https://twitter.com/eradotid/status/1721728217101578685
"@RashidRedhaa @Paltiwest @jokowi @prabowo @PDI_Perjuangan kalau tdk ada @jokowi, maka sejak 2004 sampai dgn sekarang, masih betah jadi oposisi alias tidak akan pernah jadi partai pemenang pemilu. Jokowi effect lah yg membawa @PDI_Perjuangan spt skrg ini. Dulu Mega &amp PDIP pecundang kok di masa Pak SBY &amp @PartaiDemokrat.",https://twitter.com/rakyatjenaka99/status/1721727897499808090
"@islah_bahrawi @tribunnews Kalopun mereka menang pemilu, 100% mereka akan ada d bawah ketiak Prabowo. Di depan prabowo manis, tp kenyataannya ambisi berkuasa sangat tinggi.",https://twitter.com/Mont44349290/status/1721727372809175072
"[ 🕸 Info Pemilu 2024 👨‍💻 ] Google Trends: Prabowo, Ganjar, dan Anies dalam Pencarian Dunia #Pemilu #Capres #GanjarPranowo #Prabowo #Gibran #AniesMuhaimin2024 #Indonesia #GanjarMahfud2024 #Jokowi #PrabowoGibran2024 #Pemilu2024 #PilPres https://t.co/sMsERLyW9W",https://twitter.com/gudetama_bf/status/1721725686912823526
"Polresta Samarinda Polda Kaltim, Inilah Pose-Pose Yang Dilarang dan Diperbolehkan Bagi Anggota Polri. MARI KITA SUKSESKAN PEMILU 2024"" @listyosigitprabowo @poldakaltim @divisihumaspolri @polrestasamarinda @officialkapolrestasamarinda #polisibaik #polisipenolong https://t.co/YXpXZ02fHs""",https://twitter.com/BhabinRwmakmur/status/1721717450448994432
@rakyatjenaka99 @Paltiwest @yunartowijaya Iya persis waktu pemilu dulu nya. Team survey pesanan nyatakan pasangan Prabowo Sandi menang ya! Team survey si apa itu?,https://twitter.com/anton_sukisno/status/1721715945151123498
"Dewan Pimpinan Daerah (DPD) I Partai Golkar Provinsi Banten berharap, pengusungan Prabowo Subianto-Gibran Rakabuming Raka, berefek positif pada suara partai di Pemilu Legislatif (Pileg) 2024. #rakyatmerdeka #gibranmasukgolkar #gibranrakabuming https://t.co/3c9xcCT5zb",https://twitter.com/_rakyatmerdeka/status/1721715342739997153
Partai Golkar peduli kepada anak muda #airlanggahartarto #golkarindonesia #jokowi #jokowidodo #prabowo #golkar #golkarprabowo #gibran #aniesbaswedan #ganjarpranowo #politik #pemilu https://t.co/2tpLTCgFGJ,https://twitter.com/talkaboutthis__/status/1721708529516794094
Saatnya anak muda di berikan kepercayaan untuk memimpin negeri 💯 #airlanggahartarto #golkar #golkarindonesia #golkarprabowo #gibran #gibranrakabumingraka #cawapres2024 #capres2024 #politik #pemilu #jokowi #kaesange https://t.co/F4aZMW3O8v,https://twitter.com/talkaboutthis__/status/1721706679409266989
"Airlangga Sebut Khofifah Akan Bantu Menangkan Prabowo-Gibran di Jatim Nanti akan memenangkan di Jawa Timur. Bu Khofifah yang didukung oleh Golkar dalam Pemilu yang lalu dan ke depan ini akan mendukung pasangan Prabowo-Gibran,"" katanya. &gt &gt https://t.co/Ttt1s8G0WA #detikcom""",https://twitter.com/detikcom/status/1721706534403736034
"Gibran Rakabuming Raka , pastikan kapal besar ini berlabuh di dermaga kemenangan .. "" Pesan cawapres Koalisi Indonesia Bersatu ini cukup poetic Toh pemilu pestanya rakyat, semua capres cawapres damai - simpatisan damai, bukan tantrum everyday wkwkkwk . All In Prabowo… https://t.co/j1qGAc20vK""",https://twitter.com/NyaiiBubu/status/1721702236232003877
"@SantorinisSun Pada pilkada 2018 Ganjar dpt 58% sementara PDIP di pemilu 2019 dpt 35% suara. Pilpres 2019 selisih suara Jokowi-Prabowo 17jt, sumbangan Jateng 12jt. Kunci kemenangan Jokowi th 2019 ada di Jateng. Sanggupkah Ganjar melakukan seperti Jokowi? Apalagi ada Gibran dipihak Prabowo. https://t.co/ewuR6Xo6SL",https://twitter.com/AGoeci/status/1721700536171610177
Waspada Terhadap Berita Hoax dan Hate Speech Jelang Pemilu 2024 #polisipresisi #layananpolisi110 #humaspolreskarimun #polreskarimun #pemiluserentak2024 @listyosigitprabowo @divisihumaspolri @humaspoldakepri @polres_karimun https://t.co/nLot0vb1R6,https://twitter.com/polres__karimun/status/1721697235686273117
"Malam puncak perayaan HUT Partai Golkar ke-59 yang dihadiri langsung Bapak Presiden Joko Widodo @jokowi dan Calon Presiden dari Koalisi Indonesia Maju untuk Pemilu 2024, Bapak Prabowo Subianto @prabowo di Plataran DPP Partai Golkar. https://t.co/bkhxHqng43",https://twitter.com/airlangga_hrt/status/1721696547090702536
"Polresta Samarinda Polda Kaltim, Inilah Pose-Pose Yang Dilarang dan Diperbolehkan Bagi Anggota Polri. MARI KITA SUKSESKAN PEMILU 2024"" @listyosigitprabowo @poldakaltim @divisihumaspolri @polrestasamarinda @officialkapolrestasamarinda #polisibaik #polisipenolong #polisipeno https://t.co/WAZdQlgHLJ""",https://twitter.com/IrwanIr22487651/status/1721693969711845658
"Ini opsi ke-4 capres setelah pasangan capres Ganjar, Anis, Prabowo, ubtuk di pilih di pemilu 2024.",https://twitter.com/muharmans/status/1721693540005425444
"Polresta Samarinda Polda Kaltim, STOP POLITIK UANG. 1. Menggerus kualitas demokrasi. 2. Melemahkan legitimasi kontestan pemilu. 3. Mendorong biaya politik menjadi mahal. 4. Membuka peluang pemimpin terpilih berprilaku koruptif. @listyosigitprabowo @poldakaltim @divisihumaspolr https://t.co/hJhqV3W0x8",https://twitter.com/IrwanIr22487651/status/1721693387563393190
"Emak gue masih bisa bilang Pencitraan Jokowi sama Prabowo menjelang pemilu,"" btw""",https://twitter.com/skyguardian420/status/1721687282435117200
"@realDonaldTrump memenangkan pemilu pada umur 70 tahun, #RonaldReagan berusia 70 tahun pada Hari Pelantikannya. Pak #prabowo tentu jika terpilih nanti berusia 73 tahun, dan diyakini beliau sgt sehat dan matang, serta akan terus bersemangat dengan #gibran_tweet yang masih muda. https://t.co/jrK5tvWVlV",https://twitter.com/Samuder53291026/status/1721685985904427452
"@andre_rosiade @prabowo @gibran_tweet Anak-anaku yg baru Pemilu kali ini nyoblos, patah hati 💔saat tahu pujaanya pak @erickthohir tidak jadi disandingkan dengan Prabowo,meski beda pilihan, aq ttp support,para bocilku yg kini dewasa bahwa politik tak mesti Baperan",https://twitter.com/AchooCKR/status/1721670747402416353
"Polresta Samarinda Polda Kaltim, Inilah Pose-Pose Yang Dilarang dan Diperbolehkan Bagi Anggota Polri. MARI KITA SUKSESKAN PEMILU 2024"" @listyosigitprabowo @poldakaltim @divisihumaspolri @polrestasamarinda @officialkapolrestasamarinda #polisibaik #polisipenolong https://t.co/DSc3pgq3CK""",https://twitter.com/tayib_abdul/status/1721670149907034416
"Polresta Samarinda Polda Kaltim, STOP POLITIK UANG. 1. Menggerus kualitas demokrasi. 2. Melemahkan legitimasi kontestan pemilu. 3. Mendorong biaya politik menjadi mahal. 4. Membuka peluang pemimpin terpilih berprilaku koruptif. @listyosigitprabowo @poldakaltim @divisihumaspolri https://t.co/Ulgsmu18Tm",https://twitter.com/tayib_abdul/status/1721665988247306631
"@YRadianto Mmg mereka rajanya hoaxs.. 2014 : hasil poling pada saat pemilu Prabowo diatas dan disiarkan TVOne, 2019 : Ratna Sarumpaet rame rame nyebar hoax, 2024 : sama lagi main haoxin.. Ahh sudahlah #KamiMuak",https://twitter.com/GSiwalette/status/1721657177776250975
