tweet,tweet_url
"Andai bs berangkat ngantar bantuan &amp bs berjuang ke Palestina, bareng2 dg pak Prabowo yg pengalaman militer, Gibran yg muda bertenaga, pak Anies yg intelek, pandai bhs Arab, jg pak Ganjar yg ditugaskan partainya. Pak Mahfud? Beliau tinggal, biar bs ngurus Indonesia saja. 😬",https://twitter.com/HermawanadiCand/status/1719831977506095160
"@islah_bahrawi Yg penting pdip dan ganjar kalah, Gibran membawa harapan itu bagi prabowo dkk",https://twitter.com/jokodoloq/status/1719830631797158232
"@Dennysiregar7 Prabowo-Gibran harus menang supaya pdip dan ganjar keok dan kalah, kalo anies sih main main aja siapa tahu nasib dan garis tangan bagus",https://twitter.com/jokodoloq/status/1719829744022344126
Mari Bersama Membangun Masa Depan Lebih Baik #pendidikan #kesehatan #politik #indonesia #politikindonesia #politics #pemilu #prabowo #pilpres #viral https://t.co/gObwXplUcW,https://twitter.com/HapriSianturi/status/1689969917997576192
"Ketiga bakal calon presiden: Ganjar Pranowo, Prabowo Subianto, dan Anies Baswedan jarang menyampaikan pemikirannya soal kesehatan. Padahal, isu ini penting setelah semua keterbatasan terlihat nyata saat Pandemi Covid-19. #Kesehatan #AdadiKompas https://t.co/xHAw3YSDkN",https://twitter.com/hariankompas/status/1689183790369738753
"Kesehatan tidak hanya melibatkan tubuh, tetapi juga pikiran dapat menjadi pengingat bagi kita untuk menjaga keduanya dengan seimbang dan menyeluruh untuk mencapai kualitas hidup yang lebih baik. #indonesiaraya #prabowopresiden #kesehatan #healthcare https://t.co/Yr9IMrRHkM",https://twitter.com/HapriSianturi/status/1687440750135427072
@VIVAcoid EMG negeri ini punya Prabowo apa??? Jutaan org kuliah dalam dan luar negeri ini mau diapakan??? EMG negeri ini udh jadi negara kerajaan??? ... Mengerikan sekali Mbunuh mimpi anak anak yang lain . Apa jadi pemimpin harus jadi anak presiden????,https://twitter.com/AnggaPu11878711/status/1736490711305072765
Idealnya @bawaslu_RI melek Kurikulum Merdeka juga @jokowi @prabowo @aniesbaswedan @ganjarpranowo @Itjen_Kemdikbud @nadiemmakarim @KPAI_official Sehingga tema dan konsep debat pun harus beririsan dengan program pendidikan karakter para pelajar. https://t.co/5XgQ9njtRl,https://twitter.com/Rahmat6913/status/1736270311732207968
"@ZulkifliLubis69 @gibran_tweet @prabowo Klw dari jwbn prtama pnanya .. jlas lah gibran naruh mic krna itu yg mw dia perbaiki ke depannya, makanya jdi dia yg nanya spya klw jdi dia bisa bngun tempat pltihan atw perbaiki kurikulum yg cocok utk kerjaan di IKN .. gitu ga sih ?",https://twitter.com/Town72174500/status/1736218568025604102
"Pendidikan menjadi fokus utama Prabowo-Gibran, dengan rencana pengembangan kurikulum yang relevan dengan kebutuhan industri #02UntukIndonesiaMaju 17Program PrioritasPraGibs",https://twitter.com/naufalyogaa/status/1735557061382177239
@pedagang_kritik @Heraloebss @gibran_tweet @prabowo @golkar_id @Gerindra @datuakrajoangek @psi_id Akan muncul 1 generasi yg sedari kecil bercita cita menjadi Anak Presiden Kurikulum Pendidikan perlu dirubah total mulai dr PAUD sampai pendidikan tinggi,https://twitter.com/MaliminRinaldi/status/1735478292730577329
"Caleg koruptor, Prabowo seharusnya memperbaiki kurikulum anti korupsi di partainya. @eiciroo https://t.co/FoauTyzRqK",https://twitter.com/FeniMellinda/status/1735221593377554657
"Kelima permasalahan itu, yakni bahasa isyarat di kurikulum sekolah menengah atas, skema berbagi cuti melahirkan antara ayah dan ibu, #MenataMasaDepan #BersamaPrabowoGibran #PrabowoGemoy Prabowo Gibran",https://twitter.com/srisusilawati52/status/1735151776146600391
"Kelima permasalahan itu, yakni bahasa isyarat di kurikulum sekolah menengah atas, skema berbagi cuti melahirkan antara ayah dan ibu, #MenataMasaDepan #BersamaPrabowoGibran #PrabowoGemoy Prabowo Gibran",https://twitter.com/LubisDarlina/status/1735144070769766545
"@Thoriqfauzn Di pemerintahan Prabowo, nanti kurikulum perkuliahan di kampus bakal ilangin beban angin buat segala perhitungan wkwkwk",https://twitter.com/rianto_jose/status/1734581971832160428
Jakarta - Menteri Pertahanan Prabowo Subianto mengatakan bahwa dirinya selalu mendukung kemajuan pesantren. Pesantren yang kuat dan mandiri akan menghasilkan pendidikan bermutu untuk santrinya. https://t.co/82ziEOAVVt,https://twitter.com/politikngaji2/status/1736436914390184249
Jakarta - Menteri Pertahanan Prabowo Subianto mengatakan bahwa dirinya selalu mendukung kemajuan pesantren. Pesantren yang kuat dan mandiri akan menghasilkan pendidikan bermutu untuk santrinya. https://t.co/NaFD8vA3Fv,https://twitter.com/autokrat_not/status/1736436431596528118
Jakarta - Menteri Pertahanan Prabowo Subianto mengatakan bahwa dirinya selalu mendukung kemajuan pesantren. Pesantren yang kuat dan mandiri akan menghasilkan pendidikan bermutu untuk santrinya. https://t.co/mP9xBaFRzO,https://twitter.com/DKliktivisme/status/1736435947137573072
Jakarta - Menteri Pertahanan Prabowo Subianto mengatakan bahwa dirinya selalu mendukung kemajuan pesantren. Pesantren yang kuat dan mandiri akan menghasilkan pendidikan bermutu untuk santrinya. https://t.co/zIu8QefaR9,https://twitter.com/indeks_politika/status/1736435239076221191
@Tan_Mar3M Di dunia ini gak ada musuh atau kawan abadi termasuk dalam berpolitik.ketika Prabowo di kritik dulu oposisi kok sekarang dukung pemerintah oleh Anies . padahal Sama kok dulu anies pernah jadi menteri pendidikan nya Jokowi.walaupun trus di pecat .🤣🤣 Semua sama 🤣🤣,https://twitter.com/AryoDj/status/1736390011661193633
"Jika Anies Menang Ganjar bisa jadi Mendagri, Prabowo Menhan lagi Jika Ganjar menang Anies bisa jadi Menteri Pendidikan (lagi) atau Menlu. Prabowo Menhan lagi Kalau Prabowo menang, ga mungkin",https://twitter.com/SafriantoSML/status/1736132890948440517
"@Naz_lira @andre_rosiade Prabowo Subianto menghasilkan tokoh2 nasional ada yg mantan menteri pecatan krn tdk bisa ikutin ritme kerja Jokowi yg ingin cepat ada inovasi/perubahan disektor pendidikan, tp mas Anies2 lbh bnyk retorika drpd bekerja nyata. Seperti JKT konsep bagus tp realisasi jeblok",https://twitter.com/mhdasuky/status/1735793855763751366
"@Metro_TV @aniesbaswedan @prabowo mungkin masih ada yg mau coba 2014 jadi TS . dpt jabatan menteri pendidikan karena pernah jadi dosen .nol kemudian jadi Gubernur DKI . hasilnya banjir jgn dibuang ke laut, dimasuki ke tanah . sekarang mau coba jadi presiden . takutnya kita di suruh makan angin tdk punya KTP .😂",https://twitter.com/hutomowidjaya26/status/1735653454486642807
"Tapi emang bagiku benar punchline Pak Anies yg sebelum kalimat ini soal Pak Prabowo tidak tahan menjadi oposisi. Politik emang aneh ges. Dinamis. Tergantung kepentinganmu dan kayak semacam suka–suka mereka🤣 Yg hitam bisa jadi putih, putih bisa hitam, bisa juga jadi abu–abu buteq",https://twitter.com/bolehmenebak/status/1735211104060744107
"@FaqihSyahrir @muchlis_ar Sayangnya, saat Anies jadi menteri, dia dipecat karena ketahuan melipat gandakan dana pendidikan ber-kali2 tanpa alasan yg logis. Ketahuan oleh Menkeu. Meninggalkan Gerindra Prabowo, yg telah menjadikan dia Gub, tanpa pamit dan pindah ke Nasdem.",https://twitter.com/qwertyrm/status/1735156411213267445
"@JontuaManik @jokowi Tanyakan gubernur Daerah anda sendiri atau menteri pendidikan dulu apa problem nya baru ke presiden, Di Jateng sama Prabowo beberapa sekolah gratis. Gw cuma ngubah cara pandang berfikir, jangan2 dikit langsung presiden, pemerintah Indonesia sudah punya peran masing2""",https://twitter.com/AquilaGems/status/1735120451008180292
"@jansen_jsp @prabowo Kalaupun tdk jadi gubernur, Pak Anies tetaplah terhormat. Aktivis mahasiswa, Rektor Paramadina, inisiator Indonesia mengajar, Menteri Pendidikan. Saran buat debat berikutnya : Ga usah ada pendukung sm sekali, berisik ! Paslon ckp didampingi beberapa orang saja biar lbh fokus",https://twitter.com/metamorf29/status/1734924633680609502
"@hewentbananas @memelord_666666 Pak Anies kalah, bisa jadi menteri pendidikan Pak Prabowo kalah, bisa jadi menhan Kalau Pak Ganjar kalah jadi menteri apa?",https://twitter.com/MFarrasA1/status/1734887429465919790
"Anies itu hanya punya mental banyak omong dan nyinyir krn gak bisa kerja. Buktinya dipecat saat menjabat menteri pendidikan, tapi ditolong sm Pak Prabowo, eh skrg malah mo ngejatuhin pak prabowo tapi di skak balik. Mampus!! #DebatCapres ORDAL Emosian Hotline Paris https://t.co/XcOMG3z3aO",https://twitter.com/Sarahamelia5599/status/1734814393995759696
@JXRI01 @maisadalsad @tvOneNews Maaf Anis awalnya pro pemerintahan makanya dikasih jabatan menteri pendidikan cuma berhubung yang disebut Menurut kabar tidak memenuhi ekspektasi makanya dipecat abis itu dia mungkin sakit hati jadilah oposisi sama Prabowo yang akhirnya jadi gubernur Jakarta..,https://twitter.com/RendyChrist1990/status/1734734555616272734
"Kehadiran Wamenhan ini mewakili Menteri Pertahanan RI Prabowo Subianto @prabowo. “Kemhan akan terus memperjuangkan peningkatan aksesibilitas, pengembangan pendidikan inklusif, dan pemberdayaan ekonomi bagi penyandang disabilitas,” https://t.co/kSPTG1dH3V",https://twitter.com/Kemhan_RI/status/1734487316578856963
@DodiRahmat19095 @Gerindra @prabowo Cie akun buzer lagi cari makan Nih kukasih list 1. Dipecat dari menteri pendidikan 2. Tidak menepati janji mau jual saham bir sampai lengser gajadi2 3. Rumah DP 0% tidak terealisasi 4. Ingkari janji tolak reklamasi tapi diam2 berikan izin,https://twitter.com/bellaswann77/status/1734485673934279045
@PartaiSocmed @aniesbaswedan @Resty_J_Cayah Nanti diaktifkan lg kalo sdh jadi menteri pendidikan di era prabowo.,https://twitter.com/dewakedelapan/status/1734237055419625651
@kegblgnunfaedh Ini menteri pendidikan gimana masa banyak banget kasus gini. Harus di perbaiki baik siswa pengajar ataupun apapun. Kalo perlu ada polisi di setiap sekolah. Atau TNI. @jokowi disekolah jawa barat banyak yg minta pungli berupa infak2 yg harganya sampe 3 juta pak @jokowi @prabowo,https://twitter.com/dogydogystile/status/1733337817194103221
Prof Mu'ti Bertanya Apakah Menteri Pendidikan dari Muhammadiyah .. - https://t.co/O19jWcUbD8 https://t.co/ILhbsk7hZM #BersamaIndonesiaMaju #PrabowoGemoy #KodeKita08Gemoy,https://twitter.com/AzzrielAzaryahu/status/1733145944299020738
AHY Salat Gaib Bagi Umat Muslim di Palestina. q`h AgusYudhoyono PDemokrat Demokrat Kawal Prabowo https://t.co/TdixbNfO8k,https://twitter.com/arielssj9/status/1715377979415736606
AHY Salat Gaib Bagi Umat Muslim di Palestina. q`h AgusYudhoyono PDemokrat Demokrat Kawal Prabowo https://t.co/7tL743Q0Sf,https://twitter.com/Brownest_skin/status/1715376022529659157
@Jhonkosmik Maju terus Prabowo - Gibran Congor nya @Jhonkosmik kok di reken Pendukung Ganjar berlagak pendukung palestina,https://twitter.com/RomanAsmaradana/status/1715375993115046127
Hampir semua negara islam mendukung &amp membantu palestina segera merdeka. Salah satunya adalah Prabowo yg sempat bertemu dengan kepala kepolisian Palestina terkait bantuan militer &amp beasiswa utk para siswa Palestina ingin sekolah di Indonesia. #gerindrajateng #gerindrajawatengah https://t.co/Am1sA3uAcH,https://twitter.com/gerindrakotasmg/status/1715375235376263575
AHY Salat Gaib Bagi Umat Muslim di Palestina. q`h AgusYudhoyono PDemokrat Demokrat Kawal Prabowo https://t.co/moLLFY2dmz,https://twitter.com/Sjoekuuuh/status/1715374152046322133
"@mirashahabudin @jpnncom Semoga pak prabowo bisa benar benar merealisasikan setiap program kerja yang akan dibuat nanti. Semoga bisa membawa Indonesia ke arah lebih maju. Satu lagi, pemimpin yang mendukung kebebasan Palestina juga harus dipertimbangkan, pak prabowo pernah speak up loh",https://twitter.com/hddfsysgdcoghu/status/1715371712718790732
"@Tita83079013 Lu dukung prabowo tapi benci Palestina, padahal dulu prabowo pernah melatih taktik gerilya para pejuang militan humas makanya prabowo pernah di blacklist Amerika bloon 🤣🤣🤣 https://t.co/4UxvXW41nj",https://twitter.com/LantaiAtas09/status/1718023742251847951
"Wallahu teriris rasa hati ini melihat saudara ku yg berada di Palestina sana,,, @jokowi @prabowo @Indonesia mohon lakukan yg terbaik buat saudara kita di sana pak,,, @palestine #SavePalestine hentikan genosida 🇵🇸🇵🇸❤️🇮🇩🇮🇩 https://t.co/ykny50370K",https://twitter.com/faujan_hundori/status/1717941460870545535
Pilih Prabowo jadi presiden agar Ganjar bisa lebih fokus urus Palestina.,https://twitter.com/htb_tbon/status/1717935584935804946
"Dari ketiga capres yang telah mendaftar, gw kagak lihat kepihakan ketiga capres tentang genosida penjajah Israil terhadap warga Palestina #AniesMuhaimin2024 #PrabowoGibran2024 #GanjarMahfud2024",https://twitter.com/Kobrasiyan/status/1717930742460907970
@bayoubeka @Tita83079013 @ganjarpranowo @prabowo @aniesbaswedan Sebenarnya bisa bikin janji yang lain tapikan tau lah masyarakat sibungsu kek mana kalo gak diperhatiin meregekna sampe ke Palestina wkwk,https://twitter.com/SinabungC/status/1717890429734309949
"@melodiesFLO @tanyakanrl ngga soalnyaa psti debat. ntah nonton gibran prabowo, israel-palestina sampe take me out aja kitaa debatt😭😭",https://twitter.com/romeyoure/status/1717896456697421879
Prabowo Tegaskan Dukung Palestina Sampai Merdeka https://t.co/aqFTPZMwdO,https://twitter.com/liputan6dotcom/status/1712972135713693856
@JordanMihaf Prabowo akan melanjutkan program/kebijakan jokowi yg telah menjual kedaulatan bamgsa pada cina tiongkok (komunis) dan menyengsarakan dan membunuh rakyat indonesia dgn kebijakannya jika menang pemilu INDONESIA AKAN HANCUR JIKA PRABOWO PRESIDEN DAN AKAN SEPERTI JATENG JIKA GP MNANG,https://twitter.com/baladatemp81441/status/1730009744730144799
@tempodotco Udah ketahuan kan siapa pemenang pemilu? Terus dukung bapak haji Prabowo-Gibran sebagai presiden RI 2024 H,https://twitter.com/SATIRE66/status/1730008784787915067
"@Gerindra @prabowo Pagi mindra, mumet aku, mang pemilu ga bisa dipercepat minggu apa ya ?",https://twitter.com/Kucrit138533/status/1730007560340816168
"@OssyDermawan Di dua pemilu yang lalu tidak milih Prabowo, sekarangpun juga tidak....!!!!!!",https://twitter.com/AhmadMukarom15/status/1730005218820337970
"Bertemu Prabowo, Presiden KSPN Curhat Soal Kesejahteraan Buruh https://t.co/9PDaeSFyxJ #Pemilu",https://twitter.com/liputan6dotcom/status/1729999321687576887
Alasan Prabowo-Gibran Pakai Istilah Gemoy saat Kampanye Pemilu 2024 https://t.co/8LwoEw6yyn #TempoVideo,https://twitter.com/tempodotco/status/1729998978312520093
Inilah DCT Lengkap Partai Golkar Untuk DPRD Kota Bekasi di Pemilu 2024 #airlanggahartarto #kuningkeren #PrabowoGibran #partaigolkar #golkarpedia https://t.co/C34wdKOr5S,https://twitter.com/golkarpedia/status/1729998421614895349
"Demi Pemilu Damai dan Berkualitas, Jerry Sambuaga Ajak Masyarakat Ciptakan Ruang Digital Yang Sehat https://t.co/vfqTBcD7Sd #partaigolkar #golkarpedia #airlanggahartarto #golkarprabowo #gibranmasukgolkar #kuningkeren https://t.co/m1KXLUWH0L",https://twitter.com/squadgolkar/status/1729992375672688902
"@hurryKoRn @yennywahid @prabowo Sayangnya para pendukung tidak secerdas anda dan rasanya pemilu tanpa itu semua jadi kurang asiiik, gariiing 😁",https://twitter.com/Antonius061/status/1729991399318446348
"Buat Pak @jokowi pribadi &amp para pendukung beliau harusnya ingat betul bgmn om @prabowo &amp pendukungnya di pilpres 2014 dan 2019 melawan dan bertarung di kedua pemilu tsb,hoax,caci maki,hujatan dilakukan oleh para pendukung prabowo kpd Jokowi?Yakin mrk gk dendam/sakit hati? Ngerii",https://twitter.com/CakJimar/status/1729990214033281449
"@aly_benzema Sekarang sdh kampanye, sebentar lagi Prabowo terpilih entah dengan cara apa pun. Dan akhirnya semuah orang menerima hasil pemilu dng senyuman. Aman. Sosial media sdh cukup jadi tempat u orang berkoar2, dan tdk perlu da gerakan massa, akhirnya penguasa semakin menjadi2 melanggar",https://twitter.com/Imamnusantara45/status/1729985947650138603
TKN Prabowo-Gibran Respons Pernyataan Megawati: Pemerintahan Pak Jokowi Sangat Demokratis https://t.co/AQOpCyyST6 #Pemilu,https://twitter.com/liputan6dotcom/status/1729985363316470164
Opsus Loloskan PSI pada Pemilu 2024 dan mengkan Prabowo-Gibran https://t.co/VhnCM6DJDk,https://twitter.com/soka_soka_hu/status/1729984449511911535
Pengkondisian infrastruktur Pemilu untuk kemengan Prabowo-Gibran https://t.co/S4aTWgfB1H,https://twitter.com/soka_soka_hu/status/1729984236952965450
"@Fahrihamzah Sudah lihat kan wahai netizen Indonesia. Nanti hasil pemilu yg dicurangi sekalipun dan klu KPU sdh tetapkan maka gugakan seperti apa pun tetap saja tdk akan mengubah hasil gugatan. Jadi klu Prabowo terpilih sekalipun curang nanti, tetap tdk bisa mengubah itu.",https://twitter.com/Imamnusantara45/status/1729979296037671275
Prabowo Gibran gak perlu kampanya aja menang makanya gak usah pemilu langsung di Lantik aja jadi presiden tapi di Konoha sana,https://twitter.com/pakde29875694/status/1729960002650312768
@kangdede78 Lho.lho.lho. Bukan begitu konsepnya ferguso. Apa pendukung Prabowo yang kalah di pemilu kemaren dari Jokowi harus logout dari Indonesia?.,https://twitter.com/robb_llee/status/1729955065136570827
"@gibran_tweet Demokrasi gak cuma soal menang pemilu. Harus fair dan transparan, bro! PrabowoGibran lebih diuntungkan, gak adil!"";0;0;0;0;in;992592073;1726610353914802242;naticordoves;https://twitter.com/naticordoves/status/1729936434143097182 Wed Nov 29 18:52:06 +0000 2023;1729936289359892606;@has_meliala @prabowo Rakyat harus tahu itu. @DPR_RI Komisi yang mengawasi. Apakah di setujui ❓ akal sehat kita terusik. di Tahun Politik. Berapa Negara Pemilu. Hutang LN ❓""",https://twitter.com/TampubolonTjoki/status/1729936289359892606
"dalam 2 pemilu terakhir, kubu prabowo sering melakukan blunder yang fatal diujung waktu. apakah nanti akan terjadi lagi?",https://twitter.com/djoniecash2/status/1729936178936467726
@mrchristwibowo @boechari_karim @Aryprasetyo85 @ganjarpranowo @007koteka @03__nakula @__AnakKolong @_memoryusang @Anak__Ogi @al_lasan @Miduk17 @GunRomli @gm_gm @seruanhl Kita jgn terlalu parno juga dgn orba. Megawati 99 pernah pasangan dgn Prabowo.SBY 10 tahun itu sisa orba. Jokowi jadi gub DKI didukung Prabowo gak ada tuh orba.PKI orba penculik itu adanya cuma 5 tahunan. Pas pemilu keluar semua sebagai bahan kampanye negatif. 🙏,https://twitter.com/btara_ja/status/1729929006664052941
Prabowo tunggu izin Presiden Jokowi umumkan cawapres di Pemilu 2024 - ANTARA https://t.co/Z7zjSVhv7t #BersamaIndonesiaMaju #PrabowoGemoy #KodeKita08Gemoy,https://twitter.com/AzzrielAzaryahu/status/1729921557160718357
"Dilantik sebagai KSAD, Jenderal Maruli Ungkap Pesan Jokowi soal Pemilu - detikNews https://t.co/z88JH2q7Tm #BersamaIndonesiaMaju #PrabowoGemoy #KodeKita08Gemoy",https://twitter.com/ChairudinN6548/status/1729919173445480947
"@genx36545403 @prabowo Menyadari bahwa pemilu hanyalah salah satu aspek dari kehidupan bersama, kita dapat bersama-sama berfokus pada tujuan yang lebih besar untuk kemajuan bangsa.",https://twitter.com/mirashahabudin/status/1729911962946171121
@genx36545403 @prabowo Menghargai perbedaan pilihan dalam pemilu adalah langkah awal untuk menciptakan lingkungan yang inklusif dan berdamaian.,https://twitter.com/kingslandsjay/status/1729909940393808276
"Juru Bicara Tim Kampanye Nasional (TKN) Prabowo-Gibran, Dedek Prayudi, mengatakan bahwa politik gemoy merupakan bentuk ajakan kepada pemilih muda agar mau menggunakan hak pilihnya dalam Pemilihan Umum (Pemilu) 2024.https://t.co/4pP2fxP0PC",https://twitter.com/ANTARABengkulu/status/1729906692543148432
"@Gus_Raharjo Pak prabowo itu kayak legend urban, muncul emosi tiap pemilu",https://twitter.com/rvlgenta/status/1729906120238764235
Panit Samapta Polsek Panyileukan Ipda Suraji bersama anggota melaksanakan patroli dialogis kepada warga Cibiru dalam rangka wujudkan pemilu damai 2024 #JabarAmanDamai ___________________________ @listyosigitprabowo @budisartono96 @humaspoldajbr https://t.co/HKspfzVfdW,https://twitter.com/PlskPanyileukan/status/1729904958827565333
@pro_gibran_ Prabowo-Gibran mengerti adab yang baik dalam melaksanakan pemilu. Jadi menghindari banget fitnah dan cacian,https://twitter.com/shitamwdh/status/1729904597421166593
@bengkeldodo @P4P4B0W0_2024 @99propaganda @Alexemeru @Alie_Fahnoor @AndreasSolusi @Ndons_Back @are_inismyname @florieliciouss @Bank_Joee_ @BANGSAygSUJUD Yg menikmati pesta demokrasi di pemilu pileg dan pilpres hanya pendukung pak Gemoy bapak @prabowo,https://twitter.com/SiswantoBudiut5/status/1729902100925288822
@mimih6mei @pro_gibran_ Bener banget setuju untung Prabowo Gibran mengedepankan Pemilu yang damai,https://twitter.com/ShoegameS/status/1729900722655994087
"@genx36545403 @prabowo Diberikan saja, makan siang + susu gratis walaupun hanya sekali seumur hidup. Gk ada salahnya kok. ini program karena gk punya ide briliant, gk punya gagasan cemerlang. Yg penting ketika pemilu pilih no. 1. AMIN 💪💪💪",https://twitter.com/Nugraha8Sam/status/1729899839755051287
@Lembayung071 Tiap pemilu kenapa selalu ada foto pak Prabowo 🤣🤣 itu itu lagi,https://twitter.com/benzbudhi/status/1729899222491967925
@putucangkiriku @xquitavee @KPU_ID Idiot kau ini binatang!!! Menkopolhukam mahfud Ketua satgas pemilu mahfud Kepala BIN kader PDI-P Menkumham PDI-P Mendagri PDI-P Trus curangnya yg dituduh Prabowo. Heh itu isi kpla kau taik ya!!!,https://twitter.com/freddyarjuna/status/1729896501076467895
@pro_gibran_ Komi banget nih untuk Pemilu damai keren banget Prabowo Gibran,https://twitter.com/itsmerOaLmArie/status/1729895875777024194
"Tiga pasangan capres-cawapres, yakni Anies Baswedan-Muhaimin Iskandar, Prabowo Subianto-Gibran Rakabuming Raka, Ganjar Pranowo-Mahfud MD menandatangani naskah deklarasi kampanye pemilu damai tahun 2024. https://t.co/fKUcuVepDi",https://twitter.com/KiriItuTanda/status/1729894826542567551
"@xquitavee @KPU_ID Emg blm pemilu tp kubu prabowo yg paling berpotensi utk curang.krn ini kesempatan terakhir prabowo utk nyalon,dri segi usia beliau sdh uzur dan manula.diendorse oleh rezim. Pasangannya anak penguasa,semua fasilitas dan aparat negara bisa mrk jadikan alat pemenangan.",https://twitter.com/putucangkiriku/status/1729894520270278835
@pro_gibran_ Salut banget Walau di hujat Prabowo Gibran tetap mengedepankan Pemilu Damai,https://twitter.com/A_travilla/status/1729893504326017060
"@luffyomoy @HmfaqihA lah bedanyanya apa sama survey abal2 kelompol loe ? ... kelompok loe boleh, yg lain ga boleeehhh ... sifat pendukung prabowo ga berubah dari pemilu ke pemilu .. 🤪",https://twitter.com/endonesiatwit/status/1729889676650274865
"@pro_gibran_ suka ngikutin politik semenjak Prabowo Gibran naik, krn bnrbnr ngasih cth pemilu yg damai dan sejuk",https://twitter.com/KEATON_57/status/1729889375851602285
@pro_gibran_ Prabowo Gibran bnrbnr mencontohkan Pemilu damai sihh,https://twitter.com/AlaneyF/status/1729889199460090287
"@pro_gibran_ indahnya pemilu damai, sesuai yg dblg Prabowo Gibran",https://twitter.com/saraisyaa/status/1729889052688834744
@BurhanMuhtadi Narasi yang sama tiap pemilu tapi skrg ganti posisi saja Dulu 2019 kubu Prabowo yg musuhan sama survey 2024 skrg kubu pdip yg tidk percaya survey,https://twitter.com/jayacand/status/1729888716989345932
"@Kimberley_2024 Rekayasa hukum di MK dan diperkuat dengan keputusan MKMK, Bahas yang lain gak tertarik, gue pendukung Prabowo 2 pemilu sebelumnya, jadi di mata gue dia tetep baik/layak, Fokus tentang cawapres",https://twitter.com/Ezharhap/status/1729888524806304019
"@CahyaniNingrum7 Tadinya aku mao golput di pemilu 2024. tapi setelah aku teliti capres 1 capres 2 dan capres 3. yang paling memumpuni untuk tahun 2024 ya pak prabowo uang banyak, dari segi partai ia pimpinannya, lalu programnya tidak boleh ada anak dan wanita hamil yang sengsara.",https://twitter.com/zahradara98/status/1729888274024661178
"Tiga pasangan capres-cawapres, yakni Anies Baswedan-Muhaimin Iskandar, Prabowo Subianto-Gibran Rakabuming Raka dan Ganjar Pranowo-Mahfud MD menandatangani naskah deklarasi kampanye pemilu damai tahun 2024. https://t.co/pWQBRKayUd",https://twitter.com/apahabarmedia/status/1729887630115107049
Nomor urut pasangan calon peserta pemilu presiden dan wakil presiden 2024: 1. Anies Baswedan dan Muhaimin Iskandar 2. Prabowo Subianto dan Gibran Rakabuming Raka 3. Ganjar Pranowo dan Mahfud MD #pemilu2024 https://t.co/6huNPMFLQa,https://twitter.com/PpsdesaJungsemi/status/1729887034733674753
"Menyongsong Pemilu Damai dan Berkualitas, Jerry Sambuaga Dorong Masyarakat Ciptakan Ruang Digital yang Sehat https://t.co/6LTVHdWKQG #golkar #kabargolkar #golkarindonesia #airlanggahartarto #golkar2024 #golkarsolid #golkarprabowo #ceritakankaryamudimanapun https://t.co/SLO2hXoDGM",https://twitter.com/kabargolkarnews/status/1729881400868999632
@Gerindra Pasangan Prabowo-Gibran dalam pemilu merupakan klimaks dari kegagalan reformasi,https://twitter.com/WidyaMulya47927/status/1729878809439334552
@bentalk88 @GwynxAsh @Yurissa_Samosir @AdeDhani9 @aking_adit @chaidar_2000 @Kang_Toniee @NohCeukenohhh @mustafaagus007 @MuhiqR @choymarkochoy @Harywaraz @prabowo @gibran_tweet @n_imansy27 @tatakujiyati Eh kasih unjuk Prabowo programnya terlambat ngasih makan siang gratis itu sudah didahulukan oleh umat Islam setiap hari Jumat siang dengan istilah Jumat berkah bukan karena menjelang pemilu sekali-kali Prabowo suruh salat Jumat biar tahu https://t.co/cs63ei7m1t,https://twitter.com/haidar_arash68/status/1729877702847693262
@vanc1Bozz Kelihatan banget nih Nusron ikut Prabowo malah jadi norak padahal sudah berjalan bertahun-tahun setiap selesai salat Jumat umat Islam bagi-bagi makan siang gratis eh dia mah baru mulai dan itu juga cuman cari simpatik menjelang pemilu bukan karena ketulusan,https://twitter.com/haidar_arash68/status/1729876756906348607
"Ketika kemudian masuk kepada masa kampanye, maka tindaknya adalah dugaan, misalnya dugaan tindak pidana pemilu. Karena masuk dalam larangan kampanye, lanjutnya. #PrabowoGibranIstimewa #BersamaIndonesiaMaju #PrabowoGemoy Prabowo Subianto""",https://twitter.com/YuniAkhira/status/1729876288444477587
